No,Name,Price,Kondisi,Stok
627,Sandal Gunung Talicang -Velove hitam merah new produck,85000,Baru,12
628,SABERTOOTH Sandal Gunung Traventure Byson Forenza,186000,Baru,1
629,Sandal Gunung Berkualitas - Kinkajou Palang Sandal Eiger Original,235000,Baru,8
630,Sepatu Sendal Sepeda Gunung MTB Sepatu Gowes Pria Sendal Gowes XC,185000,Baru,59
631,Sepatu Sendal Gunung Pria CONNEC CARTENZ XR Sandal kasual Cowok - HITAM,132000,Baru,3
632,OutdoorPro Sandal Gunung wanita NAGANO sendal original,125000,Baru,3
633,Sendal Jepit Gunung Outdoor Termurah Pria Wanita Sandal Pria Dan Wanita,89000,Baru,999
634,Sandal Gunung Anak Laki Laki CJR - CYU 013,102000,Baru,100
635,MARVIN GREEN FORIND x Lvnatica Sendal Gunung Original Kulit Santai Kasual Pria - Sandal Footwear,260000,Baru,1797
636,sandal gunung anak laki perempuan tali silang DM,30000,Baru,183
637,SANDAL HIKING SANDAL OUTDOOR SANDAL GUNUNG,250000,Baru,99
638,Sandal Gunung Anak Unisex Md02,53000,Baru,200
639,LUBRENE SPORTI-GL SANDAL GUNUNG WANITA,79900,Baru,8
640,OutdoorPro sandal gunung wanita Delta VX original,145000,Baru,2
641,Sandal jepit Gunung Mount Rass not eiger akasaka outdoor pro bogie,115000,Baru,10
642,sandal traveling anak laki-laki / sendal gunung anak pria / sendal gaya murah distro asli,125000,Baru,20
643,Sandal Jepit Gunung Cafu Texas Sandal Outdoor,109900,Baru,1
644,LUBRENE BERDI-GL SANDAL GUNUNG WANITA,99900,Baru,8
645,Porto Sandal Gunung Sepeda Pria Tali Kuat Travelling Casual Original PLA003M,30600,Baru,9
646,Sendal gunung anak mirip eiger Jepit Sandal bermain traveling,120000,Baru,30
647,Sandal / Sendal Gunung Hiking Trekking Outdoor Pria Wanita Murah,103500,Baru,50
648,sandal gunung OUTDOOR COLOSEUM grey. 44 45,159000,Baru,5
649,SANDAL WEDGES CIND 5019 WANITA IMPORT ORI GD GUNUNG FASHION KOREA KPOP HITAM MOCCA PUTIH PREMIUM MURAH,127900,Baru,122
650,Sandal Gunung Pria Palang Garuk Tali Polos Arei Outdoorgear,129000,Baru,6
651,SANDAL GUNUNG OUTDOOR WISATA ANAK REMAJA COWOK CEWEK LAKI WANITA PRIA,90000,Baru,11
652,SANDAL JEPIT EIGER FULL WARNA SENDAL GUNUNG,39000,Baru,997
653,"sandal gunung pria, sendal sepatu outdoor/sandal santai sehari hari",142000,Baru,12
654,MEN HIKING SANDALS QUECHUA SANDAL HIKING SENDAL HIKING SANDAL GUNUNG SENDAL GUNUNG QUECHUA,529000,Baru,3
655,sandal gunung lubrene sporti gl,75000,Baru,12
656,NO 42 CARVIL GASVAR GM BROWN TERRACOTTA sandal pria casual sandal gunung sli,99000,Baru,3
657,Outdoorpro Sandal Drift Sendal gunung jepit anak original,115000,Baru,3
658,VELO SIMBA HITAM MERAH sandal anak sandal gunung outdoor,116000,Baru,1
659,Sandal Gunung Hiking LAF Project Haji Umrah Casual Hitam Pria Wanita - 38,250000,Baru,10
660,Sendal Eiger Trocadero Oleander 2.0 Sandals Jepit Gunung - Original,239000,Baru,8
661,Sandal Gunung Outdoor Pro Arfax Vx Original,175000,Baru,100
662,LUBRENE BROWNER-GM Sandal Gunung Man,99900,Baru,8
663,Sandal Gunung Boogie Halmahera Original,179000,Baru,100
664,OutdoorPro sandal jepit wanita MEGARA sendal gunung original,125000,Baru,3
665,outdoorPro sandal gunung Alta sendal jepit original,125000,Baru,5
666,Sandal Sepatu Pria Reyl Kind Full Black Original Sendal Gunung Casual,245000,Baru,1000
667,SANDAL GUNUNG TRIGLAV ORIGINAL,65000,Baru,140
668,SANDAL GUNUNG SANDAL TRIGLAV PREMIUM SANDAL OUTDOOR SANDAL PRIA,95000,Baru,19
669,Sendal Gunung Outdoor Boogie Siau not Eiger Consina Arei,125000,Baru,12
670,SANDAL GUNUNG PRIA JEPIT OUTDOOR FULL BLACK TRAVEL ANTI SLIP PROMO,30000,Baru,998
671,Sendal Gunung Carvil GORDON Black Red Original Product,88000,Baru,10
672,SEPATU SANDAL GUNUNG HOMYPED ANAK CAPTAIN BERHADIAH BUGS HUNTER 2017,200000,Baru,38
673,Sandal Tali Gunung Wanita Korea Footwear Wanita Terbaru 37 40 SIZE,135000,Baru,188
674,OutdoorPro sandal gunung wanita Vixen VX original,155000,Baru,4
675,Salvo sandal gunung pria SG02 merah abu GRATIS sandal kasual pria S01 putih v11,81200,Baru,91
676,SABERTOOTH Sandal Gunung Traventure Rhyno Theana,186000,Baru,1
677,sandal sendal gunung outdoor ON TOP denali not eiger rei consina,129000,Baru,7
678,SANDAL SEPATU PRIA JOEY FIGHT MAROON TOTOSURYO x JOEY FOOTWEAR FULL ORIGINAL SENDAL GUNUNG SENDAL PRIA SANDAL PRIA SENDAL COWOK SANDAL GUNUNG,185000,Baru,55
679,Sandal Gunung - OUTDOOR Pro Bronco Red Footwear Jepit sendal slippers,170000,Baru,5
680,Sendal NEW-WEAL SILVANA ORIGINAL Outdoor Hiking Gunung Berkualitas Original,159000,Baru,2
681,Sandal Outdoor Pro Theya ZX Brick Women Cewek gunung travelling hiking,149000,Baru,5
682,sandal gunung outdoor kulit - TROY 795 HITAM,169000,Baru,50
683,sepatu sandal anak laki laki sendal casual gunung anak cowok murah C2 sandal outdoors anak warna hitam,120000,Baru,40
684,Sandal Gunung Pria/Sandal Pria (Catenzo)  - JJ 061,104000,Baru,48
685,Sandal Gunung Leones Alpen,150000,Baru,2
686,SENDAL GUNUNG,75000,Baru,97
687,Sandal Gunung Anak Laki Laki Jalan Jalan Travelling Fashion Anak Keren BERKUALITAS,107500,Baru,48
688,Sandal Gunung atau sandal Outdoor Pro Savero Mxt Black,135000,Baru,9
689,QUECHUA NH120 Sandal Gunung Pria Country Walking Hiking Trekking,699000,Baru,4
690,CONNEC TAMBORA Sepatu Sendal Gunung Pria Sandal Hiking Pantai Cowok,145500,Baru,2
691,Sepatu Sandal Anak Perempuan Bayi Balita Size 18 19 20 21 22 23 Usia 6 7 8 9 10 11 Bulan 1 2 3 Tahun Sendal Gunung Karet Cewek Spatu Sandal Prewalker,49900,Baru,15
692,Sandal Gunung Pria Wanita Casual Original Fashion Jepang,225000,Baru,98
693,SABERTOOTH Sandal Gunung Traventure Rhyno Forenza,186000,Baru,1
694,sandal gunung lubrene pria,90000,Baru,12
695,Kids Hiking Sandals MH120 sandal hiking sandal gunung sendal hiking,349000,Baru,2
696,Sandal Gunung Akasaka BRINA not eiger not consina not rei,195000,Baru,50
697,Sandal Gunung Sabertooth Interra Magellan - Sandal Adventure,114000,Baru,10
698,Di jamin ori sandal gunung skills mountrack traventure sendal outdoor,95000,Baru,9999
699,Sandal Gunung Trendy,110000,Baru,23
700,SANDAL GUNUNG SANDAL OUTDOOR PRO DELTA VX SENDAL JEPIT WANITA ORI,137000,Baru,2
701,SENDAL GUNUNG JEPIT EIGER SANDAL GUNUNG HIKING PRIA WANITA,150000,Baru,92
702,Sendal NEW-WEAL MOANA ORIGINAL Outdoor Hiking Gunung Berkualitas Original,109000,Baru,8
703,Sandal gunung Jepit Pria HN 13,79000,Baru,49
704,Sandal Gunung Pria Homyped MA2031 Original,295000,Baru,3
705,sandal gunung anak import carvil original,69000,Baru,10
706,Sandal Gunung Pria Kuzatura NC - KZS 562,186000,Baru,100
707,Sandal Anak sandal gunung kidsnicepair outdoors sandal webing kids Free Aksesorise,100000,Baru,22
708,Sandal Gunung Pria Golfer - GF 8214,95000,Baru,99
709,SANDAL CARVIL GUNUNG PRIA DEWASA SDL238 SDL239,92500,Baru,10
710,Sandal Gunung Anak Cowok GDSA11282 Sepatu Outdoor Anak Laki Motif Army,129000,Baru,9
711,Sandal Gunung Pria Golfer - GF 8008,104000,Baru,100
712,KIND BLACK FORIND x Reyl Sendal Gunung Original Kulit Santai Kasual Pria Sandal Footwear New Ori,295000,Baru,2800
713,Sandal Gunung Pria Raindoz - RDF 055,95000,Baru,100
714,Sandal Bayi Anak Karakter Balita Laki Laki Perempuan Sendal Gunung Umur Usia 1 2 3 4 5 Tahun,18320,Baru,1
715,SANDAL GUNUNG OUTDOOR PRO DUELER NOT EIGER CONSINA REI BOOGIE AKASAKA TEVA - KANAKA,110000,Baru,44
716,Sandal gunung japit pria HN 10,79000,Baru,50
717,Sendal Gunung Eiger Ugimba Roll Strap - Original,229000,Baru,3
718,Sandal Gunung Outdoor Pro Alta - Sandal Hiking Mendaki Pria Wanita - Sandal Jepit Traveling Outdoor,125000,Baru,3
719,Sandal Gunung Wanita Outdoor Pro Celica TX Original,154900,Baru,23
720,SANDAL AKASAKA SAGARMATHA SENDAL JEPIT OUTDOOR GUNUNG Orange,150000,Baru,2
721,Sendal Gunung Pria BlackKelly - BCL 219,114000,Baru,12
722,Sandal Gunung Pria (Java 7) - MDJ 003,119000,Baru,50
723,Sandal gunung pria wanita berkualitas terbaru 2021 - sandal gunung original best seller,190000,Baru,200
724,Sandal Gunung Pria Raindoz - RDF 026,99900,Baru,50
725,SANDAL GUNUNG JEPIT OUTDOOR PRO AQVA SENDAL JEPIT PRIA ORIGINAL,130000,Baru,10
726,SSNDAL ANAK CARVIL ALMO 01-02 SEPATU SANDAL GUNUNG ANAK LAKI-LAKI,132300,Baru,100
727,Sandal Gunung Pria Raindoz - RDF 042,102000,Baru,25
728,Sandal Gunung Pria Catenzo - NO 122,139000,Baru,99
729,Sandal Gunung Co-trek Moscow,119000,Baru,4
730,Sandal Gunung Pria Original Sendal outdoor Cowok Jepit Hiking Outdoor Adventure Dewasa Anak Anak BS,68500,Baru,999
731,SEPATU SANDAL JAPIT  PRIA COWOK LAKI WEBBING GUNUNG,95000,Baru,55
732,Sandal Gunung Pria Wanita Unisex Travel Hiking Outdoor Adventure Casual Original Premium Octopus LAF Project,250000,Baru,100
733,Outdoorpro Sandal jepit FOJA JX Sendal gunung original,140000,Baru,1
734,sandal gunung laki-laki pria - sandal casual tali Gs kuat,170000,Baru,20
735,Sandal Gunung Outdoor Adventure Original - Sandal Hiking - Sandal Outdoor - Tipe Zi Long,144900,Baru,102
736,Sandal Gunung Outdoor Ontop Kerinci,135000,Baru,2
737,Sandal gunung Jepit Pria HN 12,79000,Baru,100
738,Sendal Gunung Pria BlackKelly - LAM 514,112000,Baru,50
739,SANDAL GUNUNG,75000,Baru,91
740,PROSPECT - Sandal Jepit Webbing Outdoor Pria Multiwarna - Sendal Gunung Sports,49900,Baru,1000
741,Sandal Gunung Pria Golfer - GF 8004,119000,Baru,100
742,OUTDOOR ADV COLOSEUM 2 All Black Sandal Sepatu Sendal Gunung Pria,158000,Baru,3
743,sandal gunung cotrek Palang CSDS002042,139000,Baru,4
744,sendal gunung ontop tondano terlaris,135000,Baru,9
745,SABERTOOTH Sandal Gunung Traventure Reborn Jura Fressta,219900,Baru,100
746,SANDAL GUNUNG TRENDY MJ582,102000,Baru,60
747,CARVIL XERDAN BLACK RED sandal anak sandal gunung slide spons,109900,Baru,2
748,Sandal Connec Amazon Berkualitas Original Sendal Gunung Outdoor Indoor Kasual Sporty,119900,Baru,86
749,CARVIL XERDAN BROWN TERRACOTTA sandal anak sandal gunung slide spons,109900,Baru,1
750,SANDAL GUNUNG TRENDY MJ572,102000,Baru,60
751,sandal gunung  compass id 007,94900,Baru,20
752,Sandal Gunung Pria Golfer - GF.8006,119000,Baru,100
753,PROMO CUCI GUDANG SANDAL GUNUNG PRIA CASUAL FURION ORIGINAL SEPATU SANDAL TRAVELING OUTDOOR TRENDY,150000,Baru,5
754,CARVIL SUPERIOR BLACK RED sandal anak sandal gunung slide spons,109900,Baru,1
755,Sandal Gunung Wanita - Carvil Felita,75000,Baru,3
756,Sendal Gunung Weidenman climber 03 Hitam Original,145000,Baru,8
757,CARVIL SUPERIOR BROWN ORANGE sandal anak sandal gunung slide spons,109900,Baru,1
758,SANDAL GUNUNG TRENDY MD27,125900,Baru,60
759,Sandal Gunung outdoor BUKAN EIGER model JEPIT TALI COKLAT,175000,Baru,100
760,Perlengkapan haji dan umroh sendal cowok sendal gunung,140000,Baru,21
761,Sepatu Gunung Outdoor Slip On Original Pria Sneakers Sandal Sport Casual Olahraga Running Pantai Adventure Murah Cowok AGC110366,300000,Baru,10
762,SANDAL GUNUNG TRENDY MD28,127500,Baru,60
763,sendal gunung compass,77900,Baru,490
764,Sendal Gunung Pria BlackKelly - BCL 706,113000,Baru,100
765,SANDAL GUNUNG TRENDY MD1,127500,Baru,60
766,Sandal Gunung Premium Bandung - AKMJ 014,125000,Baru,11
767,sendal gunung,55000,Baru,10
768,Sandal Gunung Boogie Alor,125000,Baru,5
769,Sandal Gunung Cat3nzo JJ12SA,119000,Baru,1000
770,GOPRO SANDAL GUNUNG PRIA DEWASA SDL429,88800,Baru,13
771,Sandal Gunung  Sepatu Sandal Pria - Weidenmann Tornado - Dark Brown,275000,Baru,42
772,Sandal Gunung pria Warna oranye sendal gunung cowok Safiero - sandal footage arsy,44900,Baru,97
773,Sandal Gunung pria Warna coklat sendal gunung cowok Safiero - sandal arsy footage,49900,Baru,97
774,Sandal Gunung Pria Wanita Unisex Travel Hiking Adventure Outdoor Casual Original Premium Grandos LAF Project,250000,Baru,100
775,Sandal Gunung Bandung Brended - AKMJ 009,130000,Baru,11
776,Sandal Gunung Pria Catenzo - JJ 145,104000,Baru,25
777,SABERTOOTH Sandal Gunung Traventure Reborn Jura Fluenta,219900,Baru,100
778,Sandal Gunung Mustang - Sandal Pria,250000,Baru,100
779,"Sendal Casual Pria, Sendal Webbing, Sendal Gunung Pria BLRS 943",100000,Baru,3
780,Sandal Gunung Outdoor Pro IOTA,148000,Baru,12
781,Sandal Gunung Terbaru Bandung - AKMJ 001,130000,Baru,11
782,Sandal Gunung Ontop Kalimutu,120000,Baru,3
783,SENDAL GUNUNG EIGER KINKAJOU 1.0 SOL BLACK PAT - OLIVE,249000,Baru,11
784,Sendal sandal gunung outdoor anak model palang Hitam dan coklat,100000,Baru,999999
785,SANDAL SENDAL GUNUNG OUTDOOR PRO ARICA TX WOMEN SERIES ORIGINAL,144000,Baru,8
786,"Sendal Casual Pria, Sendal Webbing, Sendal Gunung Pria BLRS 593",101000,Baru,3
787,Sandal Selop Gunung Pria / Wanita Hiking.,31700,Baru,1000
788,CARVIL RAMA GM BROWN TERRACOTTA sandal pria casual sandal gunung slide,99900,Baru,2
789,Sandal Gunung Ardiles Women FIORE Abu Hitam Original Product,79000,Baru,10
790,sendal gunung Carvil Alice GL hitam merah original product,65000,Baru,10
791,Sandal Gunung Wanita-Odillon,125000,Baru,10
792,sandal gunung outdoor pro cruiser,130000,Baru,12
793,CARVIL CHESTER GM BLACK GREY sandal pria casual sandal gunung slide,99900,Baru,1
794,Sandal Gunung Keren Bandung - AKMJ 013,160000,Baru,11
795,Sandal Gunung Outdoor Pro Women Seri Leopard not eiger,110000,Baru,3
796,Sendal Jepit Gunung Outdoor Pria Beli 1 Gratis 1 JPT HN HT,139000,Baru,20
797,Sandal Gunung Outdoor Solana Zx Red Women Series Travel Daily,160000,Baru,10
798,Parling Laris SANDAL GUNUNG OUTDOOR MEN SERIES Low Price,175000,Baru,10
799,Sandal Gunung pria Warna hitam sendal gunung cowok Safiero - sandal footage arsy,44900,Baru,97
800,Sandal Gunung Outdoor Pro Savero,135000,Baru,30
801,CARVIL FUJI GM BLACK RED Sandal Pria Sandal Gunung outdoor,119900,Baru,3
802,Sandal Jepit Gunung Compass ID-007,85900,Baru,10
803,Sendal Gunung Colorado Montain Pro Hitam Biru ByBarnett Original Product,105000,Baru,7
804,Sandal Gunung Berkualitas Original Kekinian,150000,Baru,48
805,Sandal Gunung Outdoor Solana Zx Brick Women Series Travel Daily,155000,Baru,10
806,CARVIL FUJI GM GREY NAVY Sandal Pria Sandal Gunung outdoor,119900,Baru,2
807,Sandal Gunung Wigote Giza - Sandal Hiking - Sandal Mendaki - Sandal Gunung Pria - Sandal,90000,Baru,100
808,CARVIL RAMA GM BLACK RED sandal pria casual sandal gunung slide,99900,Baru,1
809,Sandal Gunung Hekla Rock Black Red Sendal Olahraga Outdoor footwear,139000,Baru,12
810,Sendal pria Sendal Gunung,140400,Baru,100
811,sandal wanita sandal outdoor pro vixen vx sendal gunung jepit women series original,135000,Baru,10
812,Sendal Gunung Anak Laki-Laki ACJJ 103,81000,Baru,6
813,Sandal Gunung Outdoor Pro Saber,145000,Baru,2
814,Sandal Gunung Outdoor Pro Bianco Women,130000,Baru,12
815,Sendal Pria - Sendal Tali Gunung - Sendal Gunung - Sendal Outdoor Pria - Sendal Casual Pria DRJJ 1148,86000,Baru,5
816,Sandal Gunung Outdoor Anak Serbaguna Connec Startrek Kids,119900,Baru,3
817,sandal gunung original,150000,Baru,98
818,Sepatu Sandal Anak Laki-Laki Sendal Gunung Anak Import,83500,Baru,100
819,Sandal Wigote Giza - Sandal Gunung - Sandal Traveling - Sandal Hiking - Sandal Mendaki,99500,Baru,100
820,sandal gunung sandal outdoor arica tx,144000,Baru,8
821,Sandal Gunung Kalianda,140000,Baru,300
822,Sandal Selop Gunung Pria,31700,Baru,10000
823,PROSPECT Sandal Gunung Anak Talincang - Sendal Outdoor Adventure Webbing Batik,49900,Baru,985
824,Sandal gunung Outdoor Stromboli Grey hiking travelling / jalan-jalan,154000,Baru,12
825,Sandal Gunung Outdoor Serbaguna Connec Krakatau,129900,Baru,2
826,Sandal Gunung Anak/Sandal Anak (Java 7) - MDJ 001,86000,Baru,47
827,Sendal Flat-Sendal Gunung Anak Laki-Laki ACJJ 100,87500,Baru,8
828,Sandal Wigote Giza - Sandal Gunung - Sandal Traveling - Sandal Hiking - Sandal Mendaki,99500,Baru,100
829,Sandal Gunung Murah Terbaru Bandung  AKMJ 001,160000,Baru,27
830,Sendal Pria - Sendal Tali Gunung - Sendal Gunung - Sendal Outdoor Pria - Sendal Casual Pria DRDF 026,86000,Baru,5
831,Sepatu Sandal Anak Laki Karakter Usia 6 7 8 9 10 11 Bulan 1 2 3 Tahun Size 20 21 22 23 24 25 Sendal Gunung Karet Balita Bayi Lelaki Cowok -193D-,29900,Baru,5
832,Sandal Pria - Sendal Gunung - Sandal Outdoor - Sandal Tracking Murah Berkualitas,185000,Baru,96
833,SANDAL OUTDOOR PRO DELTA VX SENDAL GUNUNG JEPIT ORIGINAL,135000,Baru,2
834,Sandal Gunung Outdoor Pro Arfax Tx Original,175000,Baru,100
835,MDS SANDAL GUNUNG CASUAL,65000,Baru,100
836,SENDAL GUNUNG CAFU VELO,114900,Baru,12
837,Sandal Wigote Giza - Sandal Gunung - Sandal Traveling - Sandal Hiking - Sandal Mendaki,99900,Baru,3
838,Sandal Gunung Hekla Rock Black Grey Sendal Olahraga Outdoor footwear,139000,Baru,12
839,Sendal Flat-Sendal Gunung Anak Laki-Laki ACYU 001,93000,Baru,9
840,Sendal gunung outdooor pro mouve black dan mouve brick  - SENDAL HIKING - sendal slop gelang gunung,135000,Baru,3
841,SANDAL GUNUNG ADVENTURE ON TOP ONTOP MATANA SERIES,140000,Baru,10
842,Sandal Gunung Trendy Masa Kini Sendal Outdoor  AKMJ 020,160000,Baru,27
843,Sandal Selop Pria Virale - Sandal Jepit Spons - GRATIS SANDAL FT-GUNUNG NV,80000,Baru,200
844,Sandal Ontop Tondano - Sandal Gunung - Sandal Palang - Sandal Traveling - Sandal Hiking - Sandal Mendaki,145000,Baru,100
845,sandal gunung sendal gunung jepit ontop on top Ranau,72000,Baru,15
846,Sandal Gunung Pria Catenzo CT335,158500,Baru,399
847,Sandal Gunung Anak/Sandal Anak (CJR) - CJJ 002,92000,Baru,100
848,Sendal Flat-Gunung Anak Laki-Laki ACNO 015,101000,Baru,2
849,Sandal gunung sandal outdoor murah beli 2 50rb,39800,Baru,98
850,Sandal Ontop Segara - Sandal Gunung - Sandal Traveling - Sandal Hiking - Sandal Mendaki,99500,Baru,99
851,sendal gunung sandal gunung outdoor theya vx,130000,Baru,10
852,Consina Sandal Gunung Wanita Nirwana Sandal Outdoor Ultra Light Original,275000,Baru,6
853,Sandal Gunung Wanita Hiking Haji Umrah Casual BlackPink LAF Project - 36,199000,Baru,100
854,Sandal Selop Pria Virale - Sandal Spons - Sandal Murah BELI 1 GRATIS 1 FT-GUNUNG NV,85000,Baru,20
855,Sandal Gunung pria Warna merah sendal gunung cowok Safiero murah - sandal arsy footage,44900,Baru,97
856,Sandal Gunung Pria Catenzo CT336,152500,Baru,399
857,Sandal Gunung Hiking Outdoor Pria Adinova Size 39-43 Grosir Termurah Sebukalapak,62000,Baru,999999
858,Sandal Ontop Tondano - Sandal Gunung - Sandal Palang - Sandal Traveling - Sandal Hiking - Sandal Mendaki,145000,Baru,100
859,Sandal Gunung Anak Laki Laki BlackKelly - BCL 719,103000,Baru,49
860,Sandal Jepit Gunung Pria 2 Warna - Lightspeed Pinch 2.0 Pattern,165000,Baru,3
861,Sandal gunung Colorado King 02 HT Original by barnett,115000,Baru,10
862,sandal gunung velox hitam,100000,Baru,12
863,sandal gunung velox abu.,100000,Baru,11
864,sendal gunung sandal gunung outdoor theya women series,130000,Baru,10
865,sandal gunung sandal pria original,140000,Baru,100
866,sandal gunung velox coklat.,100000,Baru,12
867,Sandal Gunung Pria Import Sendal Slop Selop Cowok Keren Empuk SP30,75900,Baru,50
868,Sandal Gunung Pria Catenzo CT337,197400,Baru,398
869,sandal gunung ontop type matana,125000,Baru,94
870,Sandal Selop Pria Virale - Sandal Spons - Sandal Murah BELI 1 GRATIS 1 FT-GUNUNG HT,85000,Baru,20
871,Sandal Gunung OUTDOOR ADVENTURE - TRITON II ORIGINAL,144900,Baru,100
872,Sandal Gunung Pria Sendal Hiking Casual Sandals Pria 504,139000,Baru,15
873,SANDAL GUNUNG PRIA KEREN TERBARU CATENZO JJ10SE,117000,Baru,60
874,sandal gunung type japit original,125000,Baru,24
875,Sandal Gunung Ontop Segara,100000,Baru,6
876,SANDAL GUNUNG PRIA KEREN TERBARU CATENZO DF51,108000,Baru,60
877,Sendal Pria - Sendal Tali Gunung - Sendal Gunung - Sendal Outdoor Pria - Sendal Casual Pria AJJ 111,114500,Baru,10
878,Sandal 11901Mall  - Sandal Gunung Sol Tracking PROMO,159000,Baru,222
879,Sandal Gunung Outdoor Pro Zuna Travel umroh,150000,Baru,12
880,SANDAL GUNUNG PRIA KEREN TERBARU CATENZO JJ81,115000,Baru,60
881,Sandal Ontop Ranau - Sandal Gunung - Sandal Palang - Sandal Traveling - Sandal Hiking - Sandal Mendaki,139000,Baru,100
882,Sendal Pria - Sendal Tali Gunung - Sendal Gunung - Sendal Outdoor Pria - Sendal Casual Pria DRJJ 1147,105000,Baru,3
883,Sandal Gunung Sandal Selempang Cozmeed Chinelos Brick,135000,Baru,17
884,SANDAL GUNUNG PRIA KEREN TERBARU CATENZO JJ13SE,119000,Baru,60
885,SANDAL GUNUNG PRIA KEREN TERBARU CATENZO DF72,108000,Baru,60
886,SANDAL GUNUNG PRIA KEREN TERBARU CATENZO JJ14D,115000,Baru,60
887,Sandal Gunung Pria Sendal Hiking Pria Original Distro 913,189000,Baru,13
888,Sandal Gunung Wanita - Sendal Omiles - Ivanka - Hitam Merah,103500,Baru,100
889,sendal japit gunung ontop series TOBA g,105000,Baru,999999
890,Sendal Gunung Anak CJr - JJ 064,125000,Baru,12
891,SANDAL GUNUNG PRIA KEREN TERBARU CATENZO JJ45,115000,Baru,60
892,Sandal Jepit Gunung Outdoor Cafu Dallas,99900,Baru,1
893,sandal gunung laki-laki/ sandal outdoor / sandal hiking adventure,120000,Baru,20
894,Sandal Gunung Wanita Korea Kasual Md 03,56000,Baru,200
895,sandal gunung sandal outdoor,145000,Baru,18
896,sendal gunung pria - sendal outdoors Model Backstrap Kombinasi,110000,Baru,20
897,sandal sol gunung talincang,125000,Baru,200
898,Sandal Pria Sandal Gunung Black Master Pylon ORIGINAL,230000,Baru,270
899,SANDAL GUNUNG ADIDAS ADILETTE BROWN WHITE ORIGINAL TERMURAH,250000,Baru,30
900,Sandal Ontop Matana - Sandal Gunung - Sandal Palang - Sandal Traveling - Sandal Hiking - Sandal Mendaki,139900,Baru,3
901,Sandal Gunung Wanita Sandal Korea Casual Md 04,55000,Baru,200
902,Sandal Gunung Anak CJR - CYU 001,97000,Baru,100
903,Sandal Gunung Outdoor Connec Arizona,119900,Baru,1
904,Sandal Gunung Outdoor Pro Arfak TX,165000,Baru,1
905,Sandal Gunung Pria Original TEBAL dan AWET - Sendal Pria Outdoor Hitam Hijau,59900,Baru,29
906,(Kiddiwear) Sandal  gunung anak / Sandal Ringan anak THUMB,114000,Baru,100
907,(Kiddiwear) Sandal  gunung anak / Sandal Ringan anak MIC,114000,Baru,100
908,(Kiddiwear) Sandal  gunung anak / Sandal Ringan anak MIC BIRU,114000,Baru,100
909,(Kiddiwear) Sandal  gunung anak / Sandal Ringan anak SPIDER,114000,Baru,100
910,(Kiddiwear) Sandal  gunung anak / Sandal Ringan anak H.K,114000,Baru,100
911,(kiddiwear) Sandal gunung anak / Sandal Ringan anak kupu kupu,114000,Baru,100
912,SABERTOOTH Sandal Gunung Traventure Reborn Tricera Fagenta,239900,Baru,99
913,Sandal Ontop Ranau - Sandal Gunung - Sandal Palang - Sandal Traveling - Sandal Hiking - Sandal Mendaki Gunung,139900,Baru,9
914,SANDAL GUNUNG PRIA KEREN TERBARU CATENZO NO12D,156000,Baru,60
915,SABERTOOTH Sandal Gunung Traventure Reborn Cambria Skylime,249900,Baru,100
916,Sandal Ontop Tondano - Sandal Gunung - Sandal Palang - Sandal Traveling - Sandal Hiking - Sandal Mendaki,145000,Baru,6
917,Sandal Motif Sendal Gunung Outdoor Trekking Hiking Harian Murah Lebay,72000,Baru,25
918,SANDAL GUNUNG PRIA KEREN TERBARU CATENZO JJ110,115000,Baru,60
919,sandal sendal gunung outdoor pro mindo 2 women series,115000,Baru,5
920,(Kiddiwear)Sandal gunung anak / Sandal Ringan anak SG DOLPHIN,114000,Baru,100
921,Sepatu Gunung Outdoor Slip On Original Pria Sneakers Sandal Sport Casual Olahraga Running Adventure Cowok Keren AGC110366,300000,Baru,10
922,"Sandal Gunung Claw, The Nuff n HD seri Classic",115000,Baru,12
923,Sandal Gunung Outdoor Pro Dueler SE,120000,Baru,2
924,(Kiddiwear) Sandal  gunung anak / Sandal Ringan anak BATT,117800,Baru,100
925,Sandal Gunung Outdoor Ontop Matana,140000,Baru,3
926,Sandal gunung ontop hiking gunung treking - Merah 39,130000,Baru,4
927,Sandal Gunung Pria Catenzo JJ 110,152800,Baru,149
928,Sendal Gunung Justrue Sandal Hiking Pria 227,189000,Baru,15
929,SANDAL GUNUNG,195000,Baru,20
930,sandal gunung anak laki laki import original brand matahari,95000,Baru,9
931,Sandal Gunung Ontop Sentani,125000,Baru,3
932,(Kiddiwear) Sandal gunung anak / Sandal Ringan anak polos SG POLOSSS,108700,Baru,100
933,Sandal Hiking Gunung Snepring Classic Jaguar Original,125000,Baru,12
934,Sandal Gunung Pria Wanita Outdoor Adventure Casual Original Premium Jack V1 Black Olive LAF Project,199000,Baru,100
935,Sandal Ontop Segara - Sandal Gunung - Sandal Traveling - Sandal Hiking - Sandal Mendaki,99900,Baru,5
936,PROMO SANDAL GUNUNG GDNS ORIGINAL,190000,Baru,20
937,PROMO SANDAL GUNUNG GDNS LUCK ORIGINAL,190000,Baru,20
938,Sendal Gunung Sendal Outdoor Urban Pria Pendaki Haiking Gunung,100000,Baru,5
939,Sandal Gunung Pria Original TEBAL dan AWET - Sendal Pria Outdoor Hitam Biru,59900,Baru,29
940,Sandal gunung wanita bertali original Lubrene,84900,Baru,1
941,Sandal Outdoor Murah Catenzo JJ 061-Sandal Gunung Murah-Sandal Adventure Terbaru,125500,Baru,110
942,Sandal Gunung Pria Sendal Cowok Sendal Gunung Selop slop Pria SP30,75900,Baru,50
943,SANDAL GUNUNG GDNS LUCK ORIGINAL VARIAN 2 WARNA,190000,Baru,20
944,SABERTOOTH Sandal Gunung Traventure Reborn Cambria Feonta,239900,Baru,100
945,SABERTOOTH Sandal Gunung Traventure Reborn Cambria Scaranta,249900,Baru,100
946,Sandal Gunung Pria Original TEBAL dan AWET - Sendal Pria Outdoor Hitam Merah,59900,Baru,28
947,Sandal Gunung Outdoor Ontop Bratan,120000,Baru,6
948,SABERTOOTH Sandal Gunung Traventure Reborn Cambria Frenta,239900,Baru,100
949,Sendal Gunung Anak CJr - JJ 114,125000,Baru,12
950,SANDAL GUNUNG JOEY FIGHT MAROON ORIGINAL,189000,Baru,190
951,sandal anak laki-laki I sendal jepit I sandal gunung murah anak bsm,110000,Baru,19
952,sandal gunung abu murah - sandal pria adventure glf,125000,Baru,15
953,SABERTOOTH Sandal Gunung Traventure Reborn Jura Foranta,219900,Baru,100
954,Sandal Gunung Trendy Masa Kini - Sendal Outdoor Original Bandung - AKMJ 023,150000,Baru,15
955,sandal gunung outdoor japit merek G-TWO original,125000,Baru,24
956,Sandal Tracking Gunung Hiking Snepring Classic Jaguar Orisinil,129000,Baru,10
957,SABERTOOTH Sandal Gunung Traventure Reborn Cambria Fagenta,239900,Baru,100
958,Sandal Anak Widenmann Winner Kids 08 - Sandal Gunung Anak Berkualitas,135000,Baru,3
959,SANDAL GUNUNG KRAKAL SLEMPANG. SANDAL GUNUNG,75000,Baru,8
960,Sandal Gunung Outdoor Pro Arfak JX,130000,Baru,2
961,Sandal gunung Wanita Oudoor Pro NEELADRI,149000,Baru,4
962,SABERTOOTH Sandal Gunung Traventure Reborn Tricera Feonta,239900,Baru,100
963,SANDAL GUNUNG ANAK KRAKAL. SANDAL KRAKAL ANAK,65000,Baru,9
964,SANDAL GUNUNG GDNS LUCK CREAM ORIGINAL,200000,Baru,19
965,Sandal Gunung/Sandal Pria (Catenzo) - JJ 045,104000,Baru,97
966,KRALZ - Sandal gunung travelling unisex Cifer black,245000,Baru,499
967,SABERTOOTH Sandal Gunung Traventure Reborn Jura Fagenta,219900,Baru,100
968,Sandal Gunung Anak Barnett-Barnett Everest Kids King 03-95 Coklat,110000,Baru,10
