No,Name,Price,Kondisi,Stok
307,Sandal Gunung Pria Wanita Sendal Hiking Haji Umrah Casual Traveling Olive Army Jack V1 LAF Project,199000,Baru,100
308,Sandal Gunung Pria Wanita Sepatu Sendal Unisex Kekinian Model Korea,120000,Baru,100
309,sendal gunung outdoor jepit original.,120000,Baru,188
310,Ugimba Pinch Strap Sandal Original - Sandal Jepit Eiger - Sandal Gunung,179000,Baru,2
311,Sendal Gunung Anak CJr Sandal sepatu JJ 90,128000,Baru,12
312,Sendal gunung Weidenmann Climber 01 Grey original,170000,Baru,7
313,Sendal Gunung Pria BlackKelly - BCL 249,112000,Baru,100
314,Di jamin ori sandal gunung skills mountrack traventure sendal outdoor terbaik,95000,Baru,9999
315,SANDAL GUNUNG ADIDAS ADILETTE BROWN BLACK ORIGINAL TERMURAH,250000,Baru,30
316,Sandal Gunung Jepit Outdoor Adventure Travel Original,119900,Baru,48
317,Sandal Gunung Outdoor Ontop Segara,100000,Baru,4
318,Sandal Gunung Pria Carvil Original Anti Air - Sendal Gunung Carvil Tidar Blue,95900,Baru,16
319,Sandal Gunung Pria Raindoz - RDF 030,99900,Baru,50
320,OBRAL MURAH sendal anak laki2 cowok sendal gunung casual anak CZR awet bagus trendy,130000,Baru,20
321,Sandal Gunung Outdoor Premium BNIB,250000,Baru,21
322,Sandal Gunung Anak Import Sol Karet Lentur  Anti Slip Motif Karakter Hero Untuk Anak Usia 1 Sampai 5 Tahun Dengan 3 Warna Pilihan Sendal Anak Keren,47200,Baru,13
323,sandal gunung outdoor pro deuler,110000,Baru,10
324,Sandal Pria Sandal Gunung Outdoor Hiking Casual Nevis NVS 54 Original,129000,Baru,997
325,sandal gunung laki-laki jepit back strap black brown original awet kuat,170000,Baru,12
326,Sandal Gunung Triglav Original Premium Army,150000,Baru,16
327,sandal gunung anak laki laki - sandal anak murah - sandal main anak bsm,105000,Baru,10
328,sandal gunung women series outdoor gaia,115000,Baru,4
329,Sepatu Sandal Wanita Import Premium Sendal Gunung Anti Licin SP032,74900,Baru,50
330,Sandal Wanita Wedges Cewek Selop Cantik Sandal Gunung Kasual Cewek Keren RV01,55000,Baru,188
331,SANDAL OUTDOOR TRIGLAV GUNUNG ORIGINAL 100,74000,Baru,12
332,sepatu sendal gunung.  sendal hiking pria. sandal gunung outdoor.  sendal sepeda mtb. sepatu sepeda gowes. sendal jack wolfskin,279000,Baru,100
333,Sandal Gunung Sabertooth Terra Magellan - Sandal Adventure,146000,Baru,15
334,sandal gunung sendal gunung outdoor D-Ranger Brick,148500,Baru,3
335,Sandal Selop Pria Outdoor Gunung Harga Murah PL-03 HTM,99000,Baru,20
336,Sandal Gunung Boogie Halmahera,170000,Baru,5
337,Sandal Gunung Wanita Casual Mayo Korean Style Size 37-40 Grosir Termurah Sebukalapak,37000,Baru,99999
338,EIGER SANDAL BHARDEV PINCH 5776 SENDAL GUNUNG OLIV DAN BLACK,239000,Baru,3
339,Sandal Gunung Pria Hipzo CT-31 Terbaru Original Hipzo,250000,Baru,1000
340,Kalibre Thunder 01 hitam Sandal Gunung Sandal Jepit 960044000,165000,Baru,39
341,Sandal Gunung pria Weidenmann sc 8993 original,245000,Baru,6
342,Outdoor Adventure Sendal Gunung Casual Warna Hitam Size Anak Dan Dewasa,75000,Baru,1000
343,Sandal Pria Hipzo CT-33 Terbaru Sandal Gunung Pria,150000,Baru,100
344,SANDAL TRIGLAV SANDAL GUNUNG SANDAL JEPIT SANDAL HIKING,85000,Baru,189
345,Sandal gunung outdoor adventure Coloseum 2 Hitam original,155000,Baru,29
346,Sandal Gunung Pria Jepit Talincang Light Speed Pria Outdoor Hiking,140000,Baru,15
347,sandal sendal gunung sport santai kasogi arizona original,79900,Baru,99
348,Sandal pria sendal cowok sendal gunung sandal terbaru sendal travel sandal jalan jalan Sandal Olahraga sandal outdoor Sandal laki laki,175000,Baru,99
349,sandal gunung murah tali hitam BM-05 sandal casual pria-remaja,110000,Baru,19
350,Sandal Gunung Pria Wanita Unisex Hiking Adventure Outdoor Travel Casual Original Premium Jack V2 Black White LAF Project,250000,Baru,100
351,Sendal Gunung Pria Sandal Gunung Outdoor Sandal Antarestar,54000,Baru,97
352,Trocadero Oleander 2.0 Original - Sandal Jepit Gunung Eiger Unisex,219000,Baru,2
353,skills sandal gunung mode japit sendal traventure,75000,Baru,110
354,SANDAL ANAK HOMYPED VELCRO SANDAL GUNUNG ANAK LAKI LAKI NO BOX,128800,Baru,100
355,SANDAL EIGER VASH ROLL STRAP 6961SANDAL KEREN ORIGINAL SANDAL GUNUNG RINGAN,369000,Baru,2
356,Consina Trawangan Sandal Gunung Pria,275000,Baru,4
357,Consina Kanawa Sandal Gunung Pria,175000,Baru,6
358,Sandal Jepit Gunung Pria Murah Beli 1 Gratis 1 HN 13,139000,Baru,20
359,Sepatu Sendal Gunung Pria CONNEC DIENG Sandal Hiking Fashion Cowok - Biru,153500,Baru,4
360,Promo Sandal Gunung CONNEC KALIMANJARO 2,129999,Baru,61
361,NEW-WEAL SILVANA Sandal Outdoor Hiking Gunung Sporty Berkualitas Original,159000,Baru,1
362,sandal gunung outdoor model jepit gunung AS Claw,99500,Baru,16
363,Sendal Gunung Weidenmann Original Sc-8904,245000,Baru,6
364,Sandal Gunung Hiking Pria Branded mdj 021,180900,Baru,99
365,Sandal Pria Gunung Hiking Haji Umrah Hijrah Casual Jack V1 LAF Project - 43,250000,Baru,100
366,Sandal Gunung Outdoor Pro Seri Saber,145000,Baru,4
367,CONNEC SANUR Sepatu Sendal Sandal Gunung Hiking Pria Cowok Berkualitas,161000,Baru,6
368,Sandal gunung Outdoor adventure Coloseum 2 Grey original,155000,Baru,50
369,Consina Mandalika Sandal Gunung Wanita,175000,Baru,4
370,Promo Sepatu Sandal Gunung Original,80000,Baru,98
371,Connec LANTANA FG Sepatu Sendal Sandal Gunung Hiking Pria Cowok,155000,Baru,1
372,Sandal Gunung Sepatu Sandal Pria - Weidenmann Tornado - Black,275000,Baru,68
373,sandal outdoor pria warna biru gunung sendal trekking murah CR-001,130000,Baru,19
374,sendal gunung jack wolfskin abu grey. sendal gunung outdoor pria. sepatu sandal hiking trecking men. sepatu sendal mtb gowes pria,279000,Baru,99
375,SPECIAL EDITION Sepatu Sepeda Karrimor MTB - Sandal Sepeda MTB Karrimor Summit - Sendal Cowok Terbaru - Sandal Gunung Pria,195000,Baru,94
376,Sandal Gunung Pria Raindoz - RNO 085,159900,Baru,100
377,Sandal Gunung Sabertooth Spectra Forenza-Sandal Adventure,114000,Baru,12
378,sandal pria hikking jet black rain-42 sendal gunung cowo casual gaya,130000,Baru,40
379,SANDAL GUNUNG SEA SALT - SANDAL SEASALT JAPIT JEMPOL PRIA SDL507,69900,Baru,15
380,skills sandal gunung mode japit sendal traventure coklat,75000,Baru,110
381,BAREL - Tri sandal tali wanita model gunung sendal sepatu wanita sandal casual empuk sandal traveling hangout wanita,375000,Baru,333
382,sendal gunung compass original,72900,Baru,98
383,Sandal Gunung Kreketan Dewasa Laki Laki Ardiles Cadmuz 01 Murah Dan Terbaru,83800,Baru,6
384,skills sandal gunung pria mode japit original sendal outdoor,75000,Baru,1199
385,Sendal atau Sandal Gunung Outdoor Boogie Bangkaru,165000,Baru,50
386,"Sandal Gunung, Sandal Hiking, Sandal Pria (Raindoz) - RJJ 1147",99000,Baru,97
387,Sandal Gunung Velo anak-anak,115000,Baru,4
388,Varro Alope Sandal pria sendal gunung kasual trendy terlaris,100000,Baru,1000
389,Sandal Gunung Carvil Vargas original,100000,Baru,15
390,Sandal Gunung Pria Golfer - GF.8003,139000,Baru,100
391,Sandal Gunung Pria Big Size Ukuran Besar Hiking Haji Umrah Jack V1 Hitam Putih LAF Project - 45,230000,Baru,99
392,Sepatu Sendal Gunung Pria CONNEC MAHAKAM Sandal Hiking Fashion Cowok - BIRU,143500,Baru,8
393,sepatu sendal Karrimor gunung outdoor gowes pria - bisa bayar di tempat cod,200000,Baru,999
394,Sendal Jepit Sandal Gunung Wakai pria couple cowo cewe abu-abu,48000,Baru,100
395,Sandal Gunung Pria Raindoz - RJJ 1154,99000,Baru,98
396,Sandal Gunung Pria  Hiking Trendy Original Lokal Bansung Murah CJJ 121,117300,Baru,11
397,Sandal Gunung Pria PEDROSSA art DAKOTA Original BNIB,240000,Baru,10
398,Sandal Pria Kulit Build up - Sendal Gunung Karrimor Outdoor - Sandal Hiking Adventure,195000,Baru,165
399,Sandal Gunung Pria Jepit Model Casual Desain Simple Elegant Trendy HARGA TERJANGKAU,100500,Baru,50
400,Sandal Premium Quality Slide On Pria Original ORLANDO Sendal Gunung Outdoor Jepit Laki-laki Terbaru CLC 27,200000,Baru,19
401,Sandal Gunung Wanita GDSW12002 Sendal Outdoor Cewek Cantik Import,149000,Baru,9
402,sandal gunung akasaka outdoor tornado jepit,135000,Baru,10
403,Sandal Gunung Casual Wanita Tali PSRT ECNTER Sandal GN Cewek Fashion Korea Sepatu Sandal Tali Velcro 2 warna Sandal Hiking Sport Wanita Dewasa,79900,Baru,1000
404,Sendal Gunung Keren Pria Trendy,114000,Baru,2
405,Sandal Gunung Anak Laki Laki CJR - CJJ 103,77000,Baru,34
406,OUTDOOR ADVENTURE NEO SPORTIVA 3 Sandal Sepatu Sendal Gunung Pria,134000,Baru,2
407,sandal gunung akasaka outdoor magma hijau jepit,135000,Baru,10
408,LUBRENE VIBER-M Sandal Gunung Man,94900,Baru,8
409,NO 42 CARVIL CASTRO GM BLACK GREY sandal pria sandal gunung jepit flip flop,99000,Baru,2
410,Sandal Gunung Carvil-Carvil Redford GM-001,115000,Baru,11
411,Sandal Japit Outdoor Hiking Gunung Oren Pria Ukuran Besar Jumbo Big Size 44 45 46 47,230000,Baru,10
412,sandal anak laki laki GS sendal gunung anak adventure - sadal anak cowok keren,130000,Baru,20
413,Sandal Gunung Boogie Rakata,165000,Baru,1
414,sandal gunung outdoor pria hitam polos termurah,24900,Baru,933
415,sandal 11903 mall Sandal Gunung Anti Jebol Best Seller,159500,Baru,222
416,Jual SEPATU SANDAL GUNUNG Slipper Fashion Red Sepatu Sendal Slipper Anak Murah,71500,Baru,12
417,Sandal Jepit Pria Airmax Laki Cowok Sendal Semi Gunung Jepit jempol Pendawa Murah Original Anti Air,70000,Baru,1
418,Sandal Gunung Ontop Kerinci,135000,Baru,4
419,Sepatu Sandal Gunung Anak Cowok Laki Lelaki Cewe Perempuan Usia 6 7 8 9 10 11 Bulan 1 2 3 4 5 6 7 Tahun Sendal Balita Bayi Cowok Karet Import -909-,49900,Baru,20
420,Sandal Gunung Anak Laki-laki,113500,Baru,4
421,QUECHUA NH50 Sandal Gunung Unisex Walking Hiking Trekking,199000,Baru,5
422,sandal gunung outdoor - sendal sepatu,149900,Baru,12
423,Sendal Gunung Anak CJr - CNO17,125000,Baru,12
424,sandal gunung anak weidenman climber k 03,125000,Baru,10
425,sandal outdoor pria / sendal gunung mnz 176,142000,Baru,13
426,sandal gunung homyped pandawa 02 berhadiah mainan mobil 2020,314800,Baru,60
427,Sendal Gunung Wanita quechua- Sendal Traveling Ori Decathlon NH100 sandal gunung sepatu sendal quechua,249000,Baru,10
428,Sandal Sendal Arei Navajo Gunung Outdoor,129000,Baru,9999
429,Sandal Gunung Outdoor Pria Merk MUSTANG Promo Murah BNIB,76000,Baru,100
430,Sandal Gunung Pria Original Sendal Hiking Travelling Outdoor Casual Import,225000,Baru,99
431,Sandal gunung Weidenmann Bomber original,269000,Baru,8
432,Sandal Gunung Anak . Sendal Jepit Anak Warna . Sendal Outdoor . Sendal Anak Laki Laki Dan Perempuan,79000,Baru,1000
433,Sandal Gunung / Sandal Tali / Sendal Gunung PortoLite A 003 M,98000,Baru,50
434,Sandal Gunung Pria - Caldera Men Pattern Original Berkualitas,260000,Baru,2
435,Sandal Selop Pria Virale - Sandal Spons - Sandal Murah BELI 1 GRATIS 1 FT-GUNUNG CK,85000,Baru,10000
436,Sandal jepit pria sandal gunung jepit murah ukuran 38-42,25000,Baru,91
437,Sandal Gunung Anak Laki laki - Sendal Carvil Notori,85000,Baru,4
438,Sandal gunung pria merk connec conec,55000,Baru,987
439,sendal gunung sandal gunung rei cristalle womenseries,130000,Baru,10
440,Sandal Gunung Outdoor Connec Shiren,97900,Baru,2
441,Sandal Gunung Outdoor Adventure Coloseum Gum Original,199000,Baru,3
442,Sandal Gunung Karrimor Sendal outdoor hiking Sendal Sepeda MTB Keren,195000,Baru,98
443,promo sandal gunung spotec original,89500,Baru,3
444,sandal gunung - sendal original - sandal triglav - sandal pria wanita,95000,Baru,995
445,sandal sendal gunung sport santai camel active original,159000,Baru,99
446,Sepatu Sendal Gunung Pria CONNEC DIENG Sandal Hiking Fashion Cowok - Hitam,153500,Baru,11
447,Sandal Gunung Wedges Wanita Fashion Sport Korea Sandal Gunung Kasual Wanita Dewasa Sandal GN Hitam Cream Velcro Cewek Sepatu Sandal Hiking Outdoor,75000,Baru,997
448,Sandal Gunung Jepit Leones Colorado,95000,Baru,2
449,SEPATU SANDAL SENDAL PRIA COWOK GUNUNG WEBBING UKURAN BESAR JUMBO BIG SIZE  38 - 47,230000,Baru,31
450,SENDAL GUNUNG EIGER CALDERA,289000,Baru,3
451,Sandal Gunung Anak Bayi Laki Laki Perempuan Cowok Cewek Sendal Sepatu Balita Kecil Umur 2 3 4 tahun,19900,Baru,11
452,Sandal Gunung Pria Barlin Ks03 Original Sandal Travelling Outdoor Khaki,175000,Baru,300
453,Sandal Alope-Loco Get kaos kaki Sendal Gunung Pria,179800,Baru,1000
454,Sandal Eiger Kinkajou Pinch 3.0 Original - Sandal Jepit Gunung Pria,219000,Baru,4
455,SANDAL SENDAL COWO ANAK LAKI LAKI JEPIT GUNUNG XTREME MERAH BIRU,75000,Baru,100
456,Sandal Gunung Outdoor Pria Import Sendal Traveling - Kojo Akira,240000,Baru,97
457,SANDAL GUNUNG ANAK REMAJA  PROATT - SENDAL GUNUNG PRO ATT REMAJA SDL570,67000,Baru,16
458,sandal gunung awet / sendal cowok outdoor bsm,150000,Baru,16
459,sandal gunung anak karakter BM-05 sendal tali anak cowo-laki laki murah,99000,Baru,20
460,Sendal CARVIL NEW GENTA Gunung Dewasa - Sandal Gunung Carvil SDL238,85000,Baru,3
461,Sendal Gunung Pria Sandal Connec COLOMBIA,156000,Baru,8
462,CONNEC SANTIAGO Sepatu Sendal Sandal Gunung Hiking Pria Cowok Men,146000,Baru,15
463,Sandal Gunung Anak Homyped-Berhadiah Mobile Legends,220000,Baru,10
464,Sandal CAMOU Borneo White - Sandal Gunung Sandal Tali Pria Anti Slip CLG112,129000,Baru,1000
465,Sendal Gunung Pria Sandal Outdoor Adventure INFINITY - RED,153000,Baru,1
466,Sandal Gunung Japit Sandal Outdoor Pro Dueler Coral,110000,Baru,12
467,Sendal Jepit Outdoor Or Sandal gunung or Sandal adventure The best,65000,Baru,100
468,Sendal Peltro Gunung Boogie Bangkaru Hitam Original,199900,Baru,23
469,Sandal Pria Joemen S 26 New Wanita Sendal Gunung Outdoor Original Joemen,110000,Baru,800
470,Sandal Gunung Outdoor Pro Gora Original not Sandal Eiger,165000,Baru,9
471,Sandal Gunung Pria Wanita Hiking Sendal Haji Umrah Traveling Outdoor Sabai LAF Project,460000,Baru,100
472,TERBARU 2022 HOMYPED LEGENDS 02 HITAM sandal gunung anak berhadiah,210000,Baru,3
473,sandal pria - sandal carvil pria -sandal gunung pria - sandal gunung carvil,75000,Baru,26
474,FORCLAZ TREK500 Sandal Ultra Ringan Gunung Hiking Unisex,499000,Baru,2
475,sandal gunung weidenmann adventure 10,135000,Baru,57
476,Sandal Gunung Anak HOMYPED - PANDAWA Biru - Hitam - Abu BERHADIAH CAKRA,198000,Baru,100
477,SANDAL GUNUNG SANDAL PRIA SANDAL TRIGLAV ORIGINAL,94999,Baru,19
478,Sandal Gunung LAF Project Big SIze Besar Hiking Haji Umrah Pria Hitam - 45,229000,Baru,5
479,Sandal Gunung Pria Original TEBAL dan AWET - Sendal Pria Outdoor Hitam Abu,59900,Baru,29
480,Sepatu Sendal Sandal Gunung Hiking Anak Laki Connec Winner T Original,136900,Baru,100
481,Sandal Gunung Pria - Sandal Gunung Weidenmann Himalaya,179000,Baru,48
482,Sandal Gunung Barnett-Vado Mountain 08,120000,Baru,11
483,SANDAL GUNUNG SANDAL JEPIT TRIGLAV SANDAL OUTDOOR HIKING,74000,Baru,5
484,Sandal Gunung Outdoor Pro Original - Sandal Outdoor - Sandal Hiking - Saber,154900,Baru,24
485,Sendal Gunung Hitam Pria Keren - Sandal Hiking Pria,109250,Baru,1
486,Sandal Gunung Boogie Bangkaru Original,189000,Baru,100
487,"Sandal Anak Laki Laki, Sandal Casual, Sandal Gunung (CJR) - CJJ 095",92000,Baru,46
488,Sandal Gunung Ontop Segara - Sandal Hiking - Sandal Mendaki - Sandal Gunung Pria - Sandal,99000,Baru,10
489,Sandal Gunung Jepit Sendal Jepit Outdoor Pria Wanita Ontop Wigote,100000,Baru,94
490,Sandal Gunung Outdoor Ontop Arabia,125000,Baru,3
491,SANDAL SENDAL GUNUNG TRIGLAV ORIGINAL OUTDOOR,65000,Baru,134
492,SANDAL TRIGLAV GUNUNG OUTDOOR SERIES ORI,65000,Baru,109
493,GO PRO TERMINATOR CP SANDAL GUNUNG ANAK,78750,Baru,3
494,sendal gunung pria - sepatu sandal gunung strap kombinasi,135000,Baru,12
495,Sepatu Sendal Gunung Pria CONNEC MAHAKAM Sandal Hiking Fashion Cowok - HITAM,143500,Baru,4
496,sandal pria bagus murah - sendal jepit gunung pria bcl - sandal main cowok bagus kuat,112000,Baru,20
497,Sandal Gunung Consina Trawangan Original,275000,Baru,9
498,NEW-WEAL MOANA Sandal Jepit Outdoor Hiking Gunung Kwalitas Original,109000,Baru,5
499,Sandal Gunung Connec Original,80000,Baru,47
500,sandal gunung homyped anak new model,160000,Baru,23
501,SENDAL GUNUNG CALDERA ORIGINAL BLUE - SENDAL EIGER,279000,Baru,7
502,Sandal Pria Sendal Gunung Hiking Pria ERG,75000,Baru,1000
503,SANDAL GUNUNG - sendal pria outdoor - hikking - trekking gunung - grc,140000,Baru,16
504,Sandal Pria - Sandal Gunung - Sandal Cowok - Sandal Tracking Original,185000,Baru,1260
505,Sandal Gunung Casual GN Korea DN05 RK3,57500,Baru,100
506,Sandal Consina Terra Sendal Gunung Outdoor,125000,Baru,30
507,SANDAL GUNUNG ARDILES PRIA SDL323,82500,Baru,30
508,Sandal Gunung Jepit Outdoor Funcover Sport,55000,Baru,48
509,Sandal Gunung Wanita - Carvil Davina,75000,Baru,2
510,SENDAL EIGER SANDAL JEPIT GUNUNG,129000,Baru,1063
511,Sandal Gunung Weidenmann Adventure 09,130000,Baru,10
512,Sendal Outdoor - Sandal Outdoor - Sandal Gunung Pria - Sandal Jepit Gunung Outdoor Pro Wave,106000,Baru,10
513,SENDAL EIGER CALDERA ORIGINAL - SENDAL GUNUNG,289000,Baru,7
514,Sandal Gunung Leones Andes,150000,Baru,1
515,QUECHUA NH150 Sandal Gunung Wanita Country Walking Hiking Trekking,580000,Baru,5
516,Sandal Gunung Cafu Alpen,115000,Baru,36
517,sandal treveling outdoor gunung l sedal pria awet anti slip doz,130000,Baru,24
518,Sandal Gunung Hiking Adventure Pria Sendal Terbaru Cowok Trendy JB33,199000,Baru,26
519,sendal gunung anak bayi balita sepatu sandal bayi balita,185000,Baru,88
520,OUTDOOR ADV NEO WIZARD 3 Sandal Gunung Sendal Jepit Pantai Pria,92000,Baru,2
521,sendal kasual pria - sandal gunung gf - sandal hikking trekking outdoor gunung pria,166000,Baru,20
522,Sandal Gunung Anak Laki-laki HYS MATEO Import Murah modis lucu sendal fashion terbaru,44900,Baru,100
523,Sandal Outdoor Original . Sendal TRIGLAV SPIDER . Sendal Pria Dan Wanita . Sendal Jepit Gunung . Sendal Pria Sporty,149000,Baru,1000
524,SANDAL AKASAKA TEKTONIK SENDAL OUTDOOR GUNUNG,155000,Baru,6
525,PAKET PANAHAN BUSUR PANAH STANDAR BOW ANAK SD MI 5 ARROW FREE SANDAL GUNUNG,200000,Baru,44
526,Sandal Gunung Sepatu Sandal Pria Outdoor Coloseum,145000,Baru,100
527,SANDAL GUNUNG EIGER SENDAL OUTDOOR HIKING PRIA WANITA,150000,Baru,997
528,sandal anak perempuan tali pink lucu sendal gunung anak cewek CZR sandal anak size 32-37,120000,Baru,23
529,CHALE HITAM FORIND x Tragen Sendal Gunung Original Ori Santai Kasual Cowok Pria Sandal Footwear,250000,Baru,990
530,Sandal Gunung Wanita - Carvil Vivien,75000,Baru,2
531,Sandal Gunung Pria Wanita Hiking Sendal Traveling Outdoor Haji Umrah Mukava LAF Project,460000,Baru,100
532,Sepatu Sandal Slop Gunung Anak Balita Bayi Perempuan Karakter Bear Laki Lelaki Cowok Cewe Usia 6 7 8 9 10 11 Bulan 1 2 3 4 5 6 7 Tahun Sendal Karet,49900,Baru,10
533,CONNEC SINDORO Sepatu Sendal Gunung Pria Sandal Hiking Pantai Cowok,155000,Baru,6
534,sandal gunung anak homyped  berhadiah mobil remot ichiban 02,274000,Baru,12
535,Sandal Gunung Big Size 44 45 46 47 48 49,250000,Baru,15
536,Sandal Gunung Pria Capilari - XDB 600,89000,Baru,15
537,Sandal Gunung Anak Outdoor Cafu Apollo,104900,Baru,2
538,SEPATU SANDAL OUTDOOR GUNUNG KASUAL KULIT SAPI ASLI HITAM BLACK ALIGATOR,260000,Baru,14
539,KRALZ Sandal gunung kasual Sandal pria - Brave series,255000,Baru,496
540,Sandal Gunung Eiger Kinkajou Roll 2.0 Original - Sandal Gunung Pria,259000,Baru,3
541,sandal gunung pria - sendal hikking murah - sandal outdoor laki GSS-199,145000,Baru,49
542,Homyped Anak Sandal Gunung Berhadiah-Pandawa02-Abu,399900,Baru,3
543,OUTDOOR ADVENTURE NEO BARBARIAN 3 Sandal Sepatu Sendal Gunung Pria,115000,Baru,1
544,Sandal Gunung Pria Casual Trendy Japanese Style Size 39-43 Grosir Termurah Sebukalapak,50000,Baru,999999
545,Sandal Sepatu Pria Plat D RMY809 Cream Original Sendal Gunung Casual,255000,Baru,1000
546,SANDAL GUNUNG EIGER OUTDOOR SENDAL GUNUNG HIKING,147000,Baru,85
547,ARDILES YUKO T - SANDAL GUNUNG ANAK - SANDAL MURAH,61000,Baru,2
548,sendal gunung anak homyped falcon 02 biru& sendal lebaran,270000,Baru,11
549,Sendal Gunung Anak Sandal Anak Connec Oscar Kid,115000,Baru,10
550,X LKM125 01-06 Sandal Gunung Anak Sandal Sepatu Mickey Sandal Ringan Anak 1PC 6PC LITTLE KUMA BABY,104000,Baru,100
551,Sendal Gunung casuaql Pria Joey Footwear Original Black,195000,Baru,29
552,skills sandal gunung mode japit original sendal outdoor,75000,Baru,599
553,Sendal Outdoor - Sandal Outdoor - Sandal Gunung Pria - Sandal Jepit Gunung Outdoor Pro Saber,135000,Baru,10
554,Sandal Gunung Jepit Boogie Barung,115000,Baru,3
555,SANDAL GUNUNG OUTDOOR EIGER HIKING PREMIUM,150000,Baru,99
556,X LKM125 07-11 Sandal Gunung Anak Sandal Sepatu Mickey Sandal Ringan Anak 1PC 6PC LITTLE BABY,104000,Baru,100
557,Sendal Gunung ARDILES Anak SDL646,60000,Baru,19
558,Sendal Jepit Gunung Eiger LightSpeed - Original,179000,Baru,12
559,Sandal Gunung Pria Wanita Casual Warna Merah Fashion Jepang,225000,Baru,99
560,Sepatu Sepeda Karrimor MTB - Sandal Sepeda MTB Karrimor Summit - Sendal Cowok Terbaru - Sandal Gunung Pria,185000,Baru,122
561,Sandal Gunung Sendal Anak Laki Laki Perempuan Original Premium Imaji Hijau Kuning LAF Project,199000,Baru,10
562,Sendal Gunung Ardiles Elastis MS 01 Sandal Gunung Pria Hiking Sandal Outdoor Casual Santai Tali Belakang Tipe MS01,55000,Baru,14
563,Sandal gunung pria carvil  original,90000,Baru,1
564,PROMO SANDAL GUNUNG TRIGLAV ORIGINAL OUTDOOR,150000,Baru,5
565,Sendal Gunung anak laki-laki Model Warna Kombinasi BG-04,129000,Baru,29
566,Sandal Gunung Anak Laki-laki Ukuran 31-36 Hitam Biru,125000,Baru,15
567,Sandal Sepatu Pria Barlin GVN Black White Original Sendal Gunung Ori,175000,Baru,1000
568,sandal gunung outdoor pro theya vx,145000,Baru,10
569,FASHIONHALU IMPORT SANDAL GUNUNG TRINITY  BOX DAN KAOS KAKI,109000,Baru,50
570,SABERTOOTH Sandal Gunung Traventure Byson Wallexa,186000,Baru,1
571,Sendal Gunung Eiger LightSpeed Cross Bar - Original,195000,Baru,13
572,SENDAL GUNUNG NH 50 SENDAL QUECHUA ORIGINAL SENDAL HIKING SEPATU SENDAL SANDAL GUNUNG,197000,Baru,8
573,Sendal Gunung Laki-laki sepatu sandal gunung outdoor,135000,Baru,20
574,Sandal Gunung Casual Tali Rei Tondana not Eiger Consina TNF,125000,Baru,5
575,sandal gunung anak outdoor adventure hikking bermain BN85 paling Awet Kuat,120000,Baru,35
576,sendal gunung jack wolfskin coklat brown. sandal gunung outdoor pria. sepatu sandal hiking trecking men. sepatu sandal mtb gowes pria,279000,Baru,98
577,SANDAL PRIA DAN WANITA CASUAL PROMO. SANDAL SELOP OUTDOOR. SANDAL DISTRO GUNUNG MURAH. SANDAL FLAT COWOK LAKI-LAKI,54500,Baru,1064
578,Cafana Sandal Wanita Gunung Atau Pantai Import Janica IMP-3024,180000,Baru,10
579,Sandal Gunung Sabertooth Spectra Magnazen-Sandal Adventure,114000,Baru,10
580,Sandal Gunung Anak BlackKelly - LJJ 992,99000,Baru,50
581,Sandal Gunung Pria Homyped MA2031  MA2032 kulit original,295000,Baru,5
582,sandal gunung pria brown outdoor hikking sendal casual haji BM02 murah,130000,Baru,40
583,Sandal Gunung Anak Ardiles FULLBACK dan Hadiah Mobil RC SIDEWAY,235000,Baru,99
584,Sandal Gunung Outdoor Pro Zuna Haji Umroh Travelling Santai Merah,176000,Baru,10
585,Sandal Gunung Pria Barlin Ks02 Original Sandal Travelling Outdoor Full Black,215000,Baru,299
586,BEST SELLER sandal gunung pria murah CTO-031 coklat sendal outdoor original ukuran 38-39-40-41-42-43,110000,Baru,19
587,HOMYPED MME 30 KOPI sandal gunung pria casual slip on kulit,379000,Baru,2
588,Sandal Gunung Pria Original Nevis NVS 72,119900,Baru,9999
589,SANDAL GUNUNG SANDAL OUTDOOR PRO POLAR SENDAL JEPIT PRIA,72000,Baru,30
590,Sandal Gunung Tali Velcro Wanita Sepatu Sandal Tali Cewek Murah Trendy Sandal Gunung Perempuan Murah Fashionable,62900,Baru,992
591,Sandal Gunung Outdoor Connec Amazon,119900,Baru,1
592,SANDAL GUNUNG JAPIT ANAK ARDILES SDL614,75000,Baru,15
593,sandal gunung weidenmann  tornado black.original,265000,Baru,24
594,SENDAL GUNUNG EIGER KINKAJOU BLACK - SANDAL EIGER,259000,Baru,5
595,Sepatu Sendal Gunung Pria - Sendal Hiking Mendaki Outdoor - Sandal Outdoor Pria - Sendal Trecking Mendaki,279000,Baru,100
596,Sendal atau Sandal Gunung Outdoor Boogie Manipa,165000,Baru,50
597,SABERTOOTH Sandal Gunung Traventure Reborn Tricera Fressta,239900,Baru,100
598,Sandal Anak - Sandal Homy Ped - Sandal Gunung Anak - Gratis Mobil Remot,341800,Baru,99
599,Otiv Flex Bold - Sandal Travelling Sandal Strap Gunung Pria,345000,Baru,8
600,Sendal Gunung Eiger LightSpeed - Original,195000,Baru,15
601,Sandal Karrimor Gunung Sendal karimor outdoor hiking Sendal Sepeda MTB Keren,185000,Baru,36
602,Sandal Gunung Outdoor Pro Foja JX,130000,Baru,2
603,Sandal Gunung Wanita - Carvil Zivania,85000,Baru,2
604,SENDAL LEBARAN HOMYPED SHOOTER 02 navy SENDAL GUNUNG ANAK NEW 2017,240000,Baru,23
605,SANDAL SENDAL COWO PRIA GUNUNG HIKING XTREME JEPIT,65000,Baru,100
606,Sandal Jepit Gunung Outdoor Ontop Raya,135000,Baru,4
607,Sandal gunung Weidenmann Climber - 05 Original,175000,Baru,8
608,CONNEC KAMIDIA Sepatu Sendal Sandal Gunung Hiking Wanita Cewek Women,125000,Baru,5
609,Consina Labengki Sandal Gunung Wanita,275000,Baru,5
610,Sandal Selop Pria Virale - Sandal Jepit Spons - Sandal Murah GRATIS SANDAL FT-GUNUNG CK,80000,Baru,20
611,sepatu sandal gunung premium. sendal gunung hiking pria. sandal hiking outdoor men premium quality,350000,Baru,98
612,Sandal gunung triglav Premium original Limited series,150000,Baru,196
613,Cafana Sandal Wanita Import Gunung Terra IMP-3036,180000,Baru,10
614,sandal gunung akasaka outdoor brantas edm hitam polos,175000,Baru,10
615,Sandal jepit Pria Sendal Gunung jepit Hiking Pria ERG,65000,Baru,7852
616,Sandal Gunung Talicang -Angel coklat orangge new produck,85000,Baru,12
617,Sandal Gunung Talicang -Victoria Coklatkrem new produck,85000,Baru,12
618,Sandal Gunung Pria Wanita Casual Full Black Import,225000,Baru,99
619,Sandal Skechers Woman Goga Max Sandal Gunung Kreketan Murah Dan Terbaru Skechers original,295000,Baru,10
620,Sandal Gunung Outdoor Pro Seri Wave,115000,Baru,5
621,Sandal Gunung Eiger 910004823 004 Kinkajou Pinch 1.0 Black Olive - Sendal Outdoor,199000,Baru,9
622,Sandal Gunung Outdoorpro Cruiser sendal original,135000,Baru,2
623,skills sakti sandal gunung pria mode japit original sendal outdoor,75000,Baru,1299
624,SABERTOOTH Sandal Gunung Traventure Byson Magellan,186000,Baru,1
625,Sandal Gunung Anak Laki laki - Sendal Outdoor Go Travel,115000,Baru,2
626,Sandal Gunung Wanita - Sendal Omiles - Vanya,95000,Baru,1
