No,Name,Price,Kondisi,Stok
969,sandal gunung bagus murah glf - sandal pria hikking adventure,125000,Baru,15
970,Sandal Gunung Pria Keren Murah Dan Berkualitas - CJJ 081,109400,Baru,10
971,SANDAL GUNUNG GDNS LUCK ORIGINAL TERBARU,200000,Baru,20
972,SANDAL GUNUNG GDNS LUCK ORIGINAL TRENDI,200000,Baru,19
973,SENDAL GUNUNG PRIA JOEY FIGHT BROWN TOTOSURYO x JOEY FOOTWEAR FULL ORIGINAL SANDAL GUNUNG SENDAL PRIA SANDAL PRIA SENDAL COWOK SANDAL COWOK,185000,Baru,56
974,Sandal Gunung Outdoor Adventure Natalia,139000,Baru,6
975,Sandal Gunung Outdoor Pro Arfak VX,165000,Baru,2
976,sandal gunung SABERTOOTH original size 39 40 42,120000,Baru,6
977,SENDAL GUNUNG CONSINA KANAWA,175000,Baru,12
978,SANDAL GUNUNG JOEY FIGHT ORIGINAL NEW ARRIVAL,190000,Baru,20
979,Sendal Gunung Weidenmann Climber 02 Original,170000,Baru,4
980,sandal gunung pria ORIGINAL - sendal cowok bsm - sandal distro laki,135000,Baru,12
981,SANDAL GUNUNG GDNS LUCK ORIGINAL,200000,Baru,20
982,SANDAL GUNUNG GDNS LUCK CREAM ORIGINAL TERBARU,200000,Baru,20
983,SANDAL GUNUNG GDNS LUCK BLACK ORIGINAL,189000,Baru,16
984,sandal pria bagus kuat - sandal gunung cowok bsm - sandal laki murah,99000,Baru,12
985,Sandal Gunung Pria Murah Bandung Trendy Original Lokal BEST SELLER,105800,Baru,15
986,sandal gunung carvil anak anak 1,100000,Baru,12
987,Sendal Safety Gunung Pria - Sandal Outdoor Pria - Sandal Tali Pria - Sandal Gunung Pria Berkualitas - Sandal Cowok - Sandal Adventure - Sandal Hiking,129750,Baru,4
988,SABERTOOTH Sandal Gunung Traventure Reborn Tricera Frenta,239900,Baru,100
989,Sandal Gunung Anak Outdoor Pro Volt JR,135000,Baru,2
990,SABERTOOTH Sandal Gunung Traventure Reborn Cambria Greenday,249900,Baru,100
991,Sendal Gunung Outdoor Ontop Tambara,150000,Baru,6
992,Sandal Tracking Hiking Gunung Claw Classic All New,120000,Baru,60
993,Sandal Jepit Gunung OutdoorPro Raiden - Original Terbaru Not Eiger Rei Consina Boogie,125000,Baru,2
994,sendal pria hikking - sandal gunung adventure,110000,Baru,20
995,SANDAL GUNUNG GDNS URBAN ORIGINAL 2 WARNA,200000,Baru,20
996,SANDAL GUNUNG GDNS URBAN ORIGINAL WARNA NAVY,200000,Baru,20
997,SABERTOOTH Sandal Gunung Traventure Reborn Jura Frenta,219900,Baru,100
998,PROMO sandal outdoor pria warna abu sendal gunung cowok CR-004,115000,Baru,20
999,Sandal Gunung Hiking Claw All New Classic,120000,Baru,33
1000,sandal gunung pria trendy R1 sandal hikking abu abu,135000,Baru,20
1001,sandal gunung full black flip flop slippers casual outdoor hiking BM02,135000,Baru,40
1002,SANDAL GUNUNG GDNS URBAN BLACK NAVY ORIGINAL,210000,Baru,20
1003,Sandal Gunung Outdoor Pro Alta Black footwear hiking travelling,129000,Baru,20
1004,Sandal Sepatu Anak Cewek Tali Pita Sandal Gunung Anak Perempuan Lucu Jelly Shoes Anak Batita Balita Cewek  3 4 5 Tahun Murah,55000,Baru,96
1005,SANDAL GUNUNG GDNS URBAN ORIGINAL,200000,Baru,20
1006,SANDAL AKASAKA FEATHERTOP SENDAL OUTDOOR GUNUNG,155000,Baru,5
1007,SANDAL GUNUNG GDNS URBAN NAVY ORIGINAL,200000,Baru,19
1008,TERBARU 2022 HOMYPED LEGENDS 01 BIRU sandal gunung anak berhadiah,210000,Baru,1
1009,Sandal Gunung - Outdoor Pro Neeladri red,160000,Baru,12
1010,SANDAL GUNUNG GDNS LUCK NAVY ORIGINAL,200000,Baru,19
1011,Sendal Outdoor Consina Kanawa - Sendal Gunung - Sendal Outdoor - Sendal Jepit - Sendal Hiking,175000,Baru,1
1012,Sandal Gunung Outdoor Pro Original - Sandal Hiking - Sandal Outdoor - Sandal Pria,144900,Baru,58
1013,Sandal Outdoor Bolang Gunung,105000,Baru,20
1014,Sandal Gunung Anak Velo-XTrail Kid-1,105000,Baru,35
1015,SANDAL GUNUNG GDNS URBAN ORIGINAL TERLARIS,200000,Baru,20
1016,Outdoor Pro Savero MXT Brick Sandal Gunung Travel hiking travelling,135000,Baru,12
1017,SANDAL GUNUNG GDNS URBAN BLACK ORIGINAL,200000,Baru,20
1018,SANDAL GUNUNG GDNS LUCK ORIGINAL TERBARU KECE VARIAN 2 WARNA,200000,Baru,19
1019,SANDAL GUNUNG TORTOR  BLACK ORIGINAL,205000,Baru,190
1020,sandal gunung brended glf - sandal pria ori - sendal cowo adventure hikking,160000,Baru,10
1021,SEPATU SANDAL GUNUNG ANAK IMPORT MODEL VELCRO BAHAN BREATHABLE,168000,Baru,30
1022,Sandal Gunung Pria Premium Quality Original Sendal Travel Outdoor JJ,149900,Baru,19
1023,sandal gunung pria original BLK-514 sendal casual cowok outdoors bagus warna black grey,125000,Baru,14
1024,SANDAL CASUAL GDNS URBAN NAVY ORIGINAL SANDAL GUNUNG,199000,Baru,20
1025,SANDAL GUNUNG GDNS URBAN ORIGINAL WARNA HITAM,200000,Baru,20
1026,Sandal Gunung Claw Seri Jepit Elegant,115000,Baru,20
1027,SANDAL GUNUNG TRIGLAV PREMIUM OUTDOOR,94999,Baru,8
1028,SANDAL GUNUNG GDNS LUCK ORIGINAL TERBARU KECE,200000,Baru,19
1029,SANDAL GUNUNG PRIA KEREN TERBARU CATENZO NO12SA,208000,Baru,60
1030,sandal gunung ontop adventure sarangan,135000,Baru,999998
1031,"Sandal Gunung Claw, The Nuff n HD seri Jepit",100000,Baru,7
1032,Sandal Gunung Anak-Richie 81-Hitam,85000,Baru,12
1033,SANDAL GUNUNG GDNS URBAN ORIGINAL SLIDE TERSEDIA 2 WARNA,200000,Baru,20
1034,Sandal Gunung Ontop Kerinci Sandal Sendal Outdoor,135000,Baru,5
1035,Sandal Hiking Gunung Pria Catenzo 657,134000,Baru,500
1036,Sandal Outdoor Gunung Snepring Seri Jepit ORIginal No Replika,111000,Baru,12
1037,SANDAL CASUAL GDNS URBAN ORIGINAL SANDAL GUNUNG,199000,Baru,20
1038,Sandal Gunung Outdoor Pro Alta Greay footwear hiking travelling,129000,Baru,20
1039,sendal gunung wigote kuta sendal outdoor hiking sandal original,129000,Baru,8
1040,Sandal Gunung Outdoor Pro New Omega L footwear hiking travelling,170000,Baru,20
1041,SENDAL GUNUNG TRAGEN DALTON FULL BLACK TOTOSURYO x TRAGEN FOOTWEAR FULL ORIGINAL SANDAL GUNUNG,250000,Baru,55
1042,sandal gunung sporty adventure sendal olahraga hikking murah BM02 gaya,145000,Baru,40
1043,Sandal Gunung / Sepatu Sandal Pria - Carvil Fuji,115000,Baru,2
1044,sandal gunung pria capit,125000,Baru,200
1045,Sandal Gunung Wanita Outdoor Pro Celica JX,110000,Baru,2
1046,Sandal Gunung Anak CJR - CJJ 114,93000,Baru,100
1047,Sandal Snepring Seri Classic Jaguar Gunung Outdoor,130000,Baru,10
1048,Sandal Outdoor Pro Draco Original Sendal Gunung Jepit Outdoorpro,120000,Baru,3
1049,Sandal gunung jepit Omiles Tristan Grey,109000,Baru,15
1050,Sandal Gunung - Outdoor Pro Neeladri green,160000,Baru,11
1051,sandal gunung pria murah berkualitas gfl - sandal distro,120000,Baru,9
1052,SENDAL GUNUNG OUTDOOR PRO X1,199000,Baru,2
1053,sendal gunung sandal outdoor pro stromboli original,129000,Baru,10
1054,sandal gunung murah berkualitas - sandal pria outdoor hikking glf,125000,Baru,7
1055,Sandal Outdoor Gunung Claw Seri Classic New Design,120000,Baru,12
1056,Sandal Gunung Anak Cowok Kids Ardiles Onset K Murah Dan Terbaru,79800,Baru,10
1057,Sandal Gunung Outdoor Pro Saber  footwear hiking travelling,160000,Baru,10
1058,Sandal Outdoor Pro Skids Grey gunung hiking travelling sport,144500,Baru,10
1059,Sandal Sendal gunung Outdoor Pro Kale Vx Black,165000,Baru,6
1060,Sandal Outdoor Gunung Snepring Jaguar Classic Asli,125000,Baru,12
1061,Sandal Gunung Hiking Erger Versi Sepatu Sandal,20000,Baru,99
1062,SANDAL GUNUNG ANAK PROATT SDL571,58000,Baru,17
1063,sandal gunung pria original - sendal hikking cowok trendy webbing CT3,145000,Baru,20
1064,ORIGINAL SANDAL PRIA - sendal gunung - sandal kasual gf,125000,Baru,34
1065,Sandal Hiking Gunung Trekking Snepring Jepit Leopard Army Original,111000,Baru,12
1066,QUECHUA NH110 Sandal Gunung Wanita Country Walking Hiking Trekking,520000,Baru,5
1067,SANDAL GUNUNG TRAVELING HIKING PANTAI ORIGINAL OUTDOOR PRO CRUISER MTX NOT EIGER KALIBRE REI CONSINA BOOGIE,121500,Baru,100
1068,Sandal gunung CONECT KILIMANJARO 2,129900,Baru,11
1069,Sandal Gunung Outdoor Ontop Kalimutu,120000,Baru,9
1070,sandal gunung cowok outdoor R1 sendal casual pria laki laki hikking,135000,Baru,18
1071,Sandal Gunung Outdoor Tracking Snepring Jepit Leopard Ori,111000,Baru,10
1072,Sandal Gunung Pria Tali Premium Murah Original - CJJ 061,109400,Baru,10
1073,SENDAL GUNUNG OUTDOOR PRO WOMEN SERIES THEYA TX,155000,Baru,5
1074,sandal gunung pria black outdoor sendal trekking cowok CR-028 original,130000,Baru,20
1075,sandal gunung merah komb glf - sandal pria bagus murah,125000,Baru,12
1076,Sepatu Sendal Gunung Pria CONNEC DIENG Sandal Hiking Fashion Cowok - Coklat,153500,Baru,6
1077,SABERTOOTH Sandal Gunung Traventure Reborn Cambria Zodiac,249900,Baru,100
1078,Sepatu Sandal Pria - Sendal Gunung - Weidenmann Tornado,275000,Baru,32
1079,Sandal Gunung Wanita - Velox Valen,89900,Baru,2
1080,Sandal Gunung OUTDOOR PRO Stromboli,129000,Baru,20
1081,Sandal Outdoor Gunung Hiking Snepring Classic Jaguar Asli,125000,Baru,10
1082,Sandal Gunung Outdoor Pro Saber Mroon footwear hiking travelling,160000,Baru,10
1083,sandal gunung pria warna hitam outdoor trekking casual cowo CR-572 webbing hitam,105000,Baru,20
1084,SANDAL SENDAL GUNUNG ERGER THE REAL ADVENTURE NO ORIGINAL,60000,Baru,100
1085,Sandal Gunung Outdoor OD Adventure,139900,Baru,7
1086,Sandal Gunung Anak-Richie 79-Coklat,85000,Baru,12
1087,Sandal Gunung Anak CJR - CYU 012,102000,Baru,100
1088,SANDAL GUNUNG VOLVE SPICA GREY TOTOSURYO x VOLVE PROJECT SENDAL COWO,275000,Baru,55
1089,sandal pria model baru - sandal gunung pria murah - sendal distro laki bsm,142000,Baru,11
1090,Sandal Gunung Outdoor Pro Mouve Brick footwear hiking travelling,175000,Baru,20
1091,Sandal Gunung Outdoor Pro Solana,150000,Baru,2
1092,sandal gunung outdoor Mount Rass Okhots dan Andaman series - hitam 38 dan 39,105000,Baru,5
1093,sandal gunung terbaru hikking sendal adventure haji casual BM02 style,150000,Baru,40
1094,Sendal Gunung Pria CONNEC SANTIAGO Sandal Cowok - BLACK,146000,Baru,9
1095,SANDAL GUNUNG PRIA JOEY FIGHT BLACK TOTOSURYO x JOEY FOOTWEAR FULL ORIGINAL SENDAL GUNUNG SENDAL PRIA SANDAL PRIA SENDAL COWOK SANDAL COWOK,185000,Baru,55
1096,Outdoor Pro Vienna JX Brown sandal gunung jepit Women travel hiking,98000,Baru,12
1097,sandal gunung sendal sandal outdoor pro stromboli,120000,Baru,10
1098,sandal gunung pria keren dijamin awet sendal casual outdoor laki CR-027 sandal hikking,125000,Baru,20
1099,sandal gunung pria warna abu-abu sendal casual outdoor laki BLK-973,130000,Baru,26
1100,Sandal gunung jepit Omiles Tristan Brick,109000,Baru,15
1101,CARVIL CHESTER GM BEIGE / BROWN sandal pria casual sandal gunung slide,99900,Baru,2
1102,Sandal Jepit Gunung Outdoor Ontop Limboto,145000,Baru,5
1103,Sandal Gunung HEKLA Sierra Women,95000,Baru,24
1104,SABERTOOTH Sandal Gunung Traventure Reborn Cambria Skyblue,249900,Baru,100
1105,NO 43 VELO SIMBA COKLAT KREM sandal pria sandal gunung outdoor flip flop,128000,Baru,3
1106,sandal gunung hikking pria original kuat sendal outdoor laki laki CR-582,125000,Baru,20
1107,sandal gunung pria - sandal outdoor cowok adventure MG-GCC murah awet,135000,Baru,50
1108,sandal webbing pria warna abu sendal gunung outdoors cowok BLK-706 original,130000,Baru,24
1109,sandal gunung pria black webbing outdoor BLK-847 sandal hikking laki kuat awet keren,130000,Baru,20
1110,Sandal Gunung Pria Catenzo CT334,264600,Baru,398
1111,NO 43 VELO SIMBA HITAM ABU sandal pria sandal gunung outdoor flip flop,128000,Baru,2
1112,Sandal Outdoor Pro Kholo gunung hiking travelling sport,170000,Baru,20
1113,Sandal Gunung Wanita - Velox Felice,89900,Baru,1
1114,SANDAL GUNUNG WILD,135000,Baru,49
1115,Sandal Sendal Gunung Outdoor Pro Women Series Theya Zx,145000,Baru,9
1116,Sandal Outdoor Pro Theya ZX Grey pink Women Cewek gunung travel hiking,149000,Baru,5
1117,sandal gunung pria - sandal outdoor ori SPC-020 - sandal cowo kasual,165000,Baru,50
1118,Sandal Gunung OUTDOOR Neo Sportiva original,149000,Baru,15
1119,Sandal Gunung - Sendal Gunung Pria - Sandal Hiking - Sandal Gunung Jepit Outdoor Pro Alta,110000,Baru,10
1120,Sandal Gunung Sport Outdoor Hiking Refilla Motif Abu,60000,Baru,100
1121,sandal gunung pria outdoor - sendal casual cowok - sandal distro laki bsm,125000,Baru,12
1122,Sandal Gunung Footage 205 Beli 1 Gratis 1 FTG 205 -1YOS05A,120000,Baru,13
1123,sandal gunung warna merah J7 sandal outdoor pria - sendal adventure cowo,135000,Baru,9
1124,sandal gunung cowok keren glf - sendal pria outdoor hikking,125000,Baru,8
1125,sepatu sandal anak laki-laki tali coklat SPEC-014 sendal gunung anak - sendal anak pria,120000,Baru,49
1126,sandal gunung pria kasual outdoor sandal outdoor parachute original sandal pria outdoor original murah sandal hiking parachute fashion outdoor,300000,Baru,25
1127,sandal outdoor gunung pria webbing abu sendal kasual CTO-121 keren gaya,150000,Baru,20
1128,SANDAL PRIA SANDAL GUNUNG SANDAL OUTDOOR TRIGLAV ORIGINAL SANDALWANITA,95000,Baru,3
1129,Sandal Outdoor Pro Delta VX gunung hiking travelling sport,145000,Baru,10
1130,sendal gunung pria - sandal bandung - sendal adventure awer berkualitas cs,110000,Baru,10
1131,Sandal Gunung Pria Tali Premium Murah Original  AKMJ 009,150000,Baru,15
1132,Sandal Gunung Pria Tali Premium Murah Original - AKMJ 019,150000,Baru,11
1133,sendal gunung OMILES Adventure 02 original,120000,Baru,12
1134,Sandal jepit Outdoor Pro Foja hiking gunung treking,120000,Baru,19
1135,BEST SELLER sandal gunung pria murah RD02 - sendal outdoor laki-laki,140000,Baru,20
1136,Sandal Gunung Outdoor Pria Wanita Sendal Cowok Cewek,79000,Baru,3736
1137,Sandal Gunung HEKLA Caldera,125000,Baru,9
1138,SANDAL COWOK MONDAY SECRE BLACK TOTOSURYO x MONDAY FOOTWEAR FULL ORIGINAL SANDAL COWO SENDAL GUNUNG SANDAL GUNUNG,200000,Baru,55
1139,sandal gunung pria sendal outdoor pro ragna series - maroon,145000,Baru,10
1140,Sandal Gunung Outdoor Pro Volt Jr Skids footwear hiking travelling,139000,Baru,10
1141,sandal gunung -  Sandal Outdoor Pro Wave red,115000,Baru,5
1142,SENDAL GUNUNG WANITA OUTDOOR PRO NEELANDRI,139000,Baru,4
1143,Sandal Hiking Gunung Outdoor WEBBING COKLAT Original Bandung,105800,Baru,15
1144,sandal gunung pria warna abu CTO-139 sendal tali outdoor hikking laki-laki,150000,Baru,20
1145,sandal gunung pria - sendal outdoor jepit laki RD02 - sandal trekking,130000,Baru,20
1146,sandal gunung pria size 38-43 murah sendal outdoor kasual cowo CTO-045 trendy,145000,Baru,20
1147,Sandal Gunung Anak Lubrene-Lubrene Skotlet GT-90,87000,Baru,12
1148,Sandal Gunung Pria Tali Premium Murah Original Handmade Bandung- AKMJ 014,125000,Baru,10
1149,sendal gunung OMILES Adventure 01 original,120000,Baru,11
1150,sendal outdoor sandal gunung,105000,Baru,7
1151,sandal gunung wanita pink webbing outdoors R1 - sendal casual hikking adventure,140000,Baru,40
1152,sandal gunung casual pria size 38-43 outdoor gaya spon webbing CR-003,115000,Baru,20
1153,sandal gunung pria branded glf - sandal cowok ori distro,165000,Baru,8
1154,sandal webbing outdoor pria gunung hitam CTO-122 sendal trekking cowok original distro,190000,Baru,20
1155,sandal sendal gunung jepit outdoor pro Arfak Jx - grey,130000,Baru,10
1156,sandal gunung pria - sandal casual hikking MG-GCC outdoor adventure,135000,Baru,50
1157,Sendal Gunung Pria Connec LANTANA FG Sendal Hiking Cowok - COKELAT TUA,155000,Baru,4
1158,sandal gunung pria bagus murah - sandal cowok trendy - sendal hikking kuat awet,178000,Baru,12
1159,Sandal Gunung dan Travelling Garfield Navy By Osgood Footwear,210000,Baru,48
1160,Sandal Gunung Sendal Gunung Jepit Outdoor Pro Polar,72000,Baru,29
1161,sandal gunung pria - sandal tali outdoor SPC-019 - sandal casual hikking,170000,Baru,50
1162,sandal gunung pria ori - sandal hikking - sandal cowok glf - sendal outdoor adventure,160000,Baru,10
1163,Sandal Gunung Pria Wanita Hikking Adventure Model Full Abu,135000,Baru,15
1164,SANDAL CAPIT GUNUNG WILD,110000,Baru,50
1165,sandal gunung jepit pria webbing abu sendal trekking murah BLK-249 gaya original-awet,130000,Baru,22
1166,QUECHUA NH100 Sandal Gunung Wanita Country Walking Hiking Trekking,299000,Baru,5
1167,SANDAL GUNUNG WANITA GOPRO - SENDAL GUNUNG CEWEK REMAJA PUTRI GO PRO SDL416,73900,Baru,27
1168,PROSPECT - Sandal Jepit Gunung Outdoor Anak 26 sampai 35 Lightspeed Design,35000,Baru,1000
1169,sandal gunung pria terlaris - sandal outdoor cowok termurah kuat bagus,125000,Baru,12
1170,NH120 Women's Country Walking Leather Sandal GUNUNG QUECHUA SENDAL HIKING SANDAL TRAVELING,569000,Baru,3
1171,Sendal gunung Outdoor Adventure Volt original,149000,Baru,14
1172,Sandal gunung Cafu Alpaka Black Red,140000,Baru,15
1173,SANDAL HIKING - sandal gunung pria outdoors bcl,125000,Baru,12
1174,Sandal jepit Gunung CONECT Kinabalu 2,84900,Baru,9
1175,Sandal Gunung Pria Model Tali Keren Branded Original - CJJ 045,109400,Baru,3
1176,sandal pria outdoor - sendal gunung pria - sandal cowok keren - sendal distro laki bsm,125000,Baru,10
1177,SENDAL PRIA - SENDAL GUNUNG - NO SLIP RINGAN NYAMAN,150000,Baru,15
1178,Sepatu Sandal Anak Laki Laki / Sepatu Sendal Hiking Anak / Sepatu Gunung Anak,155000,Baru,30
1179,SABERTOOTH Sandal Gunung Traventure Reborn Jura Fressta - Sandal Jepit Outdoor,179000,Baru,30
1180,sandal sendal jepit - sandal anak laki-laki - sendla gunung jv anak junior,99000,Baru,47
1181,Sandal Gunung Eiger Palang Kinkajou Pinch 910004826 Grey - Sport Sandals,249000,Baru,12
1182,sandal gunung jepit pria kuat awet sendal outdoor laki warna hitam CR-015,125000,Baru,20
1183,sandal gunung - sendal gunung pria - sandal hikking jv - sandal outdoor pria jv,120000,Baru,36
1184,Sandal Anak Gunung Laki - Laki ROCKY Import 908 VCSP,78400,Baru,100
1185,Sandal Outdoor Pro Theya VX Maroon Women Cewek gunung travel hiking,149000,Baru,5
1186,SABERTOOTH Sandal Gunung Traventure Reborn Cambria Foranta,239900,Baru,100
1187,Sendal Outdoor - Sandal Outdoor - Sandal Gunung Pria - Sandal Jepit Gunung Outdoor Pro Wave,110000,Baru,10
1188,sandal gunung pria ORIGINAL - sandal main-santai - sandal cowok gaya - sendal distro MG,135000,Baru,8
1189,Sandal Outdoor Pro Hydra jepit gunung hiking travelling sport,140000,Baru,19
1190,Sandal Gunung Pria Catenzo 1361,152800,Baru,215
1191,Sandal Selop Pria Outdoor Gunung Ringan STROY,129900,Baru,1000
1192,sandal gunung hikking outdoor casual sendal adventure wanita BM02 gaya,135000,Baru,40
1193,sandal gunung pria outdoor - sendal cowok bagus kuat bcl - sandal distro laki,120000,Baru,12
1194,Sandal Hiking Adventure Gunung Snepring Classic Jaguar Green Army Ori,125000,Baru,12
1195,sandal gunung anak import original carvil asli,85000,Baru,10
1196,Sandal Gunung Outdoor Pro sendal hiking Colosseum 2 Hitam,155000,Baru,10
1197,Sendal gunung Outdoor Adventure original.,149000,Baru,14
1198,sandal gunung outdoor tapak original,60000,Baru,90
1199,Sendal Jepit Gunung Outdoor Ontop Bratan,105000,Baru,5
1200,Sandal Gunung Pria CS4 Sandal Hikking Outdoor,140000,Baru,10
1201,Sandal Gunung Hiking Pria Webbing Berkualitas Original Branded Murah,103100,Baru,8
1202,sandal gunung pria bagus murah R1 sandal cowok hikking casual gaya,135000,Baru,33
1203,SENDAL GUNUNG VOLVE ZENIT BLACK TOTOSURYO x VOLVE PROJECT SENDAL COWOK SENDAL PRIA SANDAL GUNUNG,275000,Baru,55
1204,sendal pria jepit - sendal gunung sehari-hari Traventure,110000,Baru,24
1205,Sandal Hiking Outdoor Gunung Snepring Jepit Leopard Grey Asli Ori 100%,111000,Baru,12
1206,Sandal Gunung Tracking Touring Snepring Seri Jepit Tali Panthera,125000,Baru,10
1207,Sandal Gunung HEKLA Rock,135000,Baru,22
1208,SENDAL GUNUNG OUTDOOR. S-GUARD Black/Red (ORIGINAL),150000,Baru,10
1209,Sandal Sendal Gunung Outdoor Pro seri D-Ranger,165000,Baru,4
1210,SENDAL GUNUNG EIGER KINKAJOU ORANGE,259000,Baru,7
1211,sendal pria sendal gunung pria,130000,Baru,63
1212,sandal gunung pria murah black grey CTO-013 sendal casual outdoor laki-laki,110000,Baru,20
1213,sandal outdoor savero mxt sendal gunung outdoor pro,145000,Baru,10
1214,sandal gunung terbaru murah R1 sandal pria casual trendy - sendal cowok outdoor,135000,Baru,34
1215,sandal pria - sandal gunung Backstrap Marun Kombinasi,110000,Baru,20
1216,"Sandal Gunung Claw, The Nuff n HD seri Jepit Tali",115000,Baru,7
1217,sandal gunung pria webbing hitam casual outdoor CTO-061 original awet kuat,145000,Baru,20
1218,Sandal Gunung Pria Kuat Awet Sandal Pria Hikking double strap,150000,Baru,15
1219,sandal gunung jepit pria hijau army sendal outdoor simple stylish BM02,130000,Baru,40
1220,Sandal Gunung Pria Talicang Outdoor Hikking Sandal berkualitas,140000,Baru,15
1221,Sandal Pria Outdoor hikking Sandal Gunung Bsm B5 Original,130000,Baru,10
1222,Outdoor Sandal Jepit Gunung Warna Hitam Size Anak Dan Dewasa,65000,Baru,1000
1223,Sandal Gunung Outdoor Magma Grey for hiking trekking outdoor sport,180000,Baru,10
1224,Sandal Gunung Ardiles MIno Blue Berhadiah Mobilan Sidway,210000,Baru,23
1225,sandal gunung pria - sendal outdoor cowok tali hitam MG-GCC trekking,135000,Baru,51
1226,sandal gunung pria ORIGINAL R1 sendal casual laki laki cowo BRENDED,199000,Baru,15
1227,SANDAL GUNUNG NAVARA BASIC SANDAL 3 STRAP BLACK TOTOSURYO x NAVARA FOOTWEAR SENDAL GUNUNG SANDAL PRIA SENDAL COWOK SANDAL COWOK SANDAL COWO,215000,Baru,56
1228,sandal gunung wanita - sendal outdoor hiking casual cewe BM02 pendaki,135000,Baru,40
1229,SENDAL GUNUNG SENDAL JEPIT,119900,Baru,15
1230,Sandal Gunung Outdoor Pro Savero MXT - Sandal Hiking Mendaki - Sandal Gunung Pria Wanita,130000,Baru,10
1231,Sandal Gunung Hiking Pria Wanita Raindoz 2307,152000,Baru,939
1232,kickers sendal gunung dewasa murah outdoor,71300,Baru,10
1233,Sandal Gunung Ontop Matana - Sandal Hiking - Sandal Mendaki - Sandal Gunung Pria - Sendal,130000,Baru,10
1234,Sandal Gunung Outdoor Ontop Belida Womens Series,130000,Baru,13
1235,sendal gunung cowok adventure - sandal awet ctz,130000,Baru,20
1236,Sandal Gunung Pria Wanita Unisex Hikking,150000,Baru,15
1237,Sandal gunung Colorado Montain Pro Original by barnett,115000,Baru,9
1238,Sandal gunung Cafu Alpaka Brick,140000,Baru,15
1239,SANDAL COWOK JACK DANE BLACK TOTOSURYO x JACK FOOTWEAR SANDAL COWO SENDAL PRIA SANDAL GUNUNG SENDAL COWOK SANDAL PRIA,255000,Baru,55
1240,Sandal Gunung Anak Spiderman Bahan PU IMPORT 068 VCSP,96300,Baru,100
1241,sendal pria sandal gunung Bacstrap sandal Merah,135000,Baru,20
1242,sendal pria - sandal gunung hikking - sandal awet berkualitas - sendla adventure jv,133000,Baru,12
1243,Sandal Gunung Jepit HEKLA Sierra Women,95000,Baru,36
1244,sandal gunung pria adventure Hikking sendal slippers Biru SHL-BS322,140000,Baru,10
1245,Sandal Gunung Pria Outdoor Hikking Model Full Biru,150000,Baru,10
1246,sandal pria gunung travelling hiking kojo GOW asli termurah terlaris terbaru,190000,Baru,9
1247,Sandal gunung Pria - sendal Gunung Gazventure sehari-hari,130000,Baru,20
1248,sandal pria warna hitam BLK-219 sendal outdoor cowok gunung casual keren gaya,130000,Baru,20
1249,Sandal Gunung Outdoor Hiking Refilla Sport Jepit Polos Hitam,60000,Baru,100
1250,SANDAL GUNUNG,105000,Baru,5
1251,Sandal Gunung Outdoor Ontop Tambara,145000,Baru,8
1252,Sandal Gunung Sabertooth Spectra Blushenta-Sandal Adventure,114000,Baru,11
1253,Sandal Outdoor Pro Theya TX Red Women Cewek gunung travelling hiking,150000,Baru,8
1254,Sandal Outdoor Pro Vixen TX Women gunung hiking travelling sport,145000,Baru,10
1255,SENDAL GUNUNG VOLVE ZENIT GREY TOTOSURYO x VOLVE PROJECT SENDAL PRIA SANDAL GUNUNG SENDAL COWOK,275000,Baru,55
1256,sandal sendal gunung outdoor on top ontop matana sendal pria ori,140000,Baru,10
1257,sandal gunung sendal outdoor pro women series theya TX not Eiger Rei consina,135000,Baru,2
1258,LUBRENE ARMINTO-GM SANDAL GUNUNG PRIA,92900,Baru,2
1259,SANDAL GUNUNG NAVARA PROTO GREY BLACK ORIGINAL,225000,Baru,190
1260,sandal gunung coklat 38-43 sandal pria hikking-travanture R5,120000,Baru,20
1261,sandal laki-laki sendal gunung slingback keren,185000,Baru,50
1262,Sandal Outdoor Trekking Gunung Snepring Jepit Tali Panthera Original,125000,Baru,10
1263,SANDAL GUNUNG - CLAW R Motif,105000,Baru,35
1264,Outdoor Pro Cruiser Coral Sandal Gunung travelling hiking trekking,140000,Baru,7
1265,sandal gunung pria - Sandal gunung Backstrap Biru,145000,Baru,20
1266,LUBRENE AVRIO-GT SANDAL GUNUNG ANAK - Hitam Oranye,96900,Baru,2
1267,sandal hikking simple outdoor haji casual gunung pria prefect day BM02,135000,Baru,40
1268,SENDAL GUNUNG REYL SECRET FULL BLACK TOTOSURYO x REYL FOOTWEAR FULL ORIGINAL SENDAL COWOK SANDAL GUNUNG,250000,Baru,55
1269,SANDAL CASUAL KULIT PRIA SANDAL KULIT MURAH SANDAL GUNUNG SANDAL JAPIT MURAH SANDAL MURAH SANDAL KULIT MURAH SANDAL KICKERS MURAH,70000,Baru,42
1270,Sandal Outdoor Pro Theya VX Purple Women Cewek gunung travel hiking,150000,Baru,10
1271,Sandal Gunung Outdoor Pria Cowok WEBBING LIMITED Murah Bandung Trendy,105800,Baru,20
1272,Sandal Gunung Outdoor Pro Nexus Original not Sandal Eiger,200000,Baru,10
1273,Sandal Gunung Wigote Giza - Sandal Traveling Outdoor - Sandal Hiking Mendaki Pria Wanita,100000,Baru,100
1274,Sandal Gunung Footage Gratis Sandal Pria -1YOS05A,105000,Baru,14
