No,Name,Price,Kondisi,Stok
1,Sandal Gunung Outdoor Antarestar Sandal Treveling Hiking Casual,72000,Baru,98
2,Sandal Gunung NB Pria Casual / Sandal newbalance Pria Terbaru,199000,Baru,50
3,Sandal Gunung Hijack - Sandal Pria Gunung - Sandal Hijack lentur Import Quality - Sandal Gunung Pria - Sandal Jepit Pria Keren,155000,Baru,50
4,Sandal Gunung Wanita Import Fashion Original,159000,Baru,100
5,Consina Sunburn Sandal Gunung Travelling,125000,Baru,10
6,SANDAL GUNUNG TRIGLAV PREMIUM ASLI ORIGINAL SANDAL OUTDOOR HIKING,94999,Baru,94
7,Sandal Gunung Outdoor Pro Original - Sandal Hiking - Sandal Outdoor - Gosend JKT-BKS,179900,Baru,48
8,Sendal jepit gunung Sayka,30000,Baru,481
9,Sandal Gunung Wanita Pria Sendal Gunung Tali Cewek Cowok Murah Sandal Gunung Model Korea Sepatu Sandal Gunung Tali Perempuan Laki-Laki Keren,65000,Baru,914
10,Sandal Gunung Selop Pria Casual - Selop PL 01 CK,99000,Baru,1997
11,Sandal Gunung Pria 39-43 Nevis Nvs 17 Original Sandal Pria Outdoor Hiking Traveling,119000,Baru,84
12,Sandal Gunung Anak Carvil Superior GT-300,105000,Baru,9
13,Sepatu Sandal Tali Fashion Wanita Sandal Gunung Tali Strap Bunga Cewek Sandal Sepatu Perempuan Murah Trendy Modis Kekinian Fashion korea,62900,Baru,944
14,grosir sandal gunung erger,24000,Baru,100
15,Sepatu Sandal Gunung Anak Cowok Laki Lelaki Perempuan Cewe Usia 6 7 8 9 10 11 Bulan 1 2 3 4 5 6 7 Tahun Sendal Balita Bayi Cowok Karet Import -Z558-,35900,Baru,97
16,TERMURAH TERLARIS Sandal jepit Pria Sendal Gunung Hiking Pria ERG bisa cod,65000,Baru,6218
17,SANDAL GUNUNG JUMBO SENDAL TALI BIG SIZE OUTDOOR HIKING ADVENTURE ORI - Hitam 43,66550,Baru,100
18,Sandal Gunung Hiking Model Jepit,13000,Baru,1000
19,Consina Trawangan Sandal Gunung Pria,275000,Baru,4
20,Consina Kanawa Sandal Gunung Pria,175000,Baru,6
21,Sendal Gunung Anak Perempuan Velcro Fashion Korea Style Fs 276 Hijau Pink Abu,82000,Baru,9
22,Sandal Pria Casual Sandal Gunung Pria MV02,59000,Baru,84
23,Sandal Gunung Tali Bunga Anak Cewek Lucu Sandal Pesta Anak Bunga Sport Kids Fashion Korea Sandal Sepatu Straps 2 Anak Perempuan 678910 Tahun Trendy,100000,Baru,992
24,sandal pria-sendal Gunung - Weidenmann Adventure 10,138000,Baru,15
25,SANDAL GUNUNG EIGER FULL WARNA SENDAL GUNUNG,155000,Baru,988
26,Sandal Gunung Outdoor Adv Original - Sandal Jepit Pria - Tersedia Gosend,94900,Baru,101
27,Redzeal Sandal Gunung Outdoor Pria Import Sendal Traveling,200000,Baru,296
28,SH63 Sandal Gunung Pria Import Japanese Cool Style Keren Empuk,84900,Baru,78
29,Sandal Gunung Outdoor Pria Ontop Denali Sendal Gunung,140000,Baru,5
30,NEW FASHION SANDAL ANAK IMPORT SEPATU GUNUNG ANAK LAKI-LAKI,168000,Baru,100
31,Sandal Hipzo CT 04 Pria Sandal Gunung Original,180000,Baru,991
32,Sandal Pria Joemen S13 New Wanita Sendal Gunung Outdoor Original Joemen,110000,Baru,499
33,SANDAL JEPIT GUNUNG JUMBO SENDAL OUTDOOR TERMURAH HIKING BIG SIZE ORI - Hitam 43,52300,Baru,100
34,Sandal Pria Wanita casual sendal gunung l400 coklat,99800,Baru,50
35,sendal gunung,17000,Baru,500
36,Sandal Gunung Casual Pria Original Sendal Cowok Kulit Outdoor Travelling Kasual,395000,Baru,99
37,Consina Sunburn Sandal Gunung Travelling,125000,Baru,10
38,Sandal Gunung Jelly Import Anak Laki Laki Perempuan Lucu Modis Trendy Sandal GN Velcro Anak Cowok Cewek Perekat Sepatu Sandal Jelly Kasual Anak Prepet,80000,Baru,995
39,Sepatu Sandal Anak Laki Usia 6 Bulan 1 2 3 Tahun Sendal Gunung Karet Balita Bayi Cowok Size 18-23,19900,Baru,50
40,Sandal Gunung Anak Outdoor Adventure Original - Tersedia Gosend,149900,Baru,200
41,PROSPECT Sandal Jepit Gunung Pria Lightspeed Design - Corak Batik,68900,Baru,999
42,SANDAL GUNUNG ADVENTURE TRIGLAV OUTDOOR,155000,Baru,86
43,PROSPECT Sandal Gunung Outdoor Pria Lightspeed Slipper Batik,89900,Baru,1000
44,Sandal Gunung Sendal Anak Laki Laki Perempuan Original Premium Imaji Hitam LAF Project,199000,Baru,10
45,Sandal Gunung Weidenmann Adventure 10,135000,Baru,17
46,Sandal Gunung & Outdoor Talincang - ZA Sport,36000,Baru,98
47,Sandal Cowok Fashion Gunung Hiking Casual Sandal l700 hitam,87800,Baru,99
48,Sandal Pria Joemen S 26 New Wanita Sendal Gunung Outdoor Original Joemen,110000,Baru,800
49,skills sandal gunung pria mode japit original sendal outdoor,75000,Baru,1199
50,LINKSWEAR PROMO 100 ORIGINAL LINKSWEAR Sandal Outdor Sandal Japit Gunung Pria Wanita Sandal Gunung Slip Linkswear Dark Green,175000,Baru,300
51,Di jamin ori sandal gunung skills mountrack traventure sendal outdoor terbaik,95000,Baru,9999
52,skills sandal gunung mode japit sendal traventure,75000,Baru,110
53,Di jamin ori sandal gunung skills mountrack traventure sendal outdoor,95000,Baru,9999
54,Sandal Jepit Gunung Anak & Dewasa,35000,Baru,200
55,Sandal Gunung Casual Pria Original Sendal Cowok Kulit Outdoor Travelling Kasual,395000,Baru,99
56,Sandal Jepit Anak Perempuan Bayi Balita Tali Belakang Usia 6 Bulan 1 2 3 Tahun Karakter Bebek Sendal Gunung Karet Balita Prewalker Bayi Cewek -311-,24900,Baru,3
57,Sandal Gunung Outdoor Pro Original - Sandal Hiking - Sandal Outdoor - Gosend Jakarta,154900,Baru,46
58,Karrimor Sandal Sepeda MTB Hiking Sendal Gunung Sendal Outdoor Karimor,195000,Baru,377
59,Sandal gunung Anak Laki laki,35000,Baru,150
60,Sandal gunung carvil Spextra Original 05,70000,Baru,1
61,Sandal Gunung Casual Pria B3 Original Sendal Cowok Outdoor Travelling Kasual,215000,Baru,97
62,sendal gunung korea,56000,Baru,92
63,RGR - CIREMAI Sandal Jepit Anak Remaja Tanggung Light Speed Gunung Outdoor,35000,Baru,921
64,OUTDOOR ADVENTURE TEXAS GUM Sandal Gunung Sendal Jepit Pantai Pria,133000,Baru,1
65,Sandal Gunung Tali Gesper Wanita Dewasa Sandal GN Strap 1 Perempuan Murah Sandal Hiking Wanita Fashion Korea Sandal Flat Tali Cewek Polos Hitam Pink,65000,Baru,992
66,skills sakti sandal gunung pria mode japit original sendal outdoor,75000,Baru,1299
67,Sandal Jepit Gunung Anak & Dewasa - Flogger,25000,Baru,97
68,skills sandal gunung mode japit sendal traventure coklat,75000,Baru,110
69,Sandal Gunung Wanita Terbaru Original Hipzo E-3 Sandal Santai Wanita Premium Casual,260000,Baru,100
70,skills sandal gunung mode japit original sendal outdoor,75000,Baru,599
71,PROSPECT Sandal Gunung Jepit Tali Batik Lightspeed Design,89900,Baru,460
72,Sandal Gunung Hiking Model Jepit,13000,Baru,1000
73,Sandal Pria Sandal Gunung Weidenmann Sukhoi Hitam,245000,Baru,5
74,Connec Columbia Sepatu Sendal Gunung Hiking Pria,139000,Baru,46
75,Sandal Gunung Outdoor Adventure New Coloseum 2 Original,179900,Baru,48
76,Sendal Gunung Outdoor Pro Arfak VX Original - Sandal Gunung Hiking Merk Outdoor Pro Terbaru,158000,Baru,12
77,Sandal Gunung Wanita Terbaru Original Hipzo E-3 Sandal Santai Wanita Premium Casual,260000,Baru,100
78,SANDAL PRIA DAN WANITA JEPIT GUNUNG CASUAL SANTAI PROMO. SENDAL COWOK CEWEK. SANDAL LEBARAN,54500,Baru,1034
79,Sendal Gunung Karrimor Sandal Hiking Sandal Outdoor Karimor,185000,Baru,52
80,Sandal Gunung Boogie Sambu,115000,Baru,1
81,Sandal Gunung Casual Pria B3 Original Sendal Cowok Outdoor Travelling Kasual,215000,Baru,97
82,skills sandal gunung mode japit sendal outdoor,75000,Baru,110
83,Sandal Gunung Casual Pria B7 Original Sendal Outdoor Travelling Kasual,215000,Baru,99
84,Sandal Pria Carvil Original Anti Air Sendal Jepit Cowok Pria Gunung Hiking Outdoor Dewasa Ukuran Besar 39 sd 44 jumbo hitam Strip Tali Batik Garuk,53900,Baru,4
85,Sandal Pria Wanita Original Hipzo Pria CT 03 Sendal Pria Gunung Premium Slop Import Casual,150000,Baru,100
86,Sandal Selop Pria Virale - Sandal Jepit Spons - Sandal Murah GRATIS SANDAL FT-GUNUNG HT,80000,Baru,19
87,SANDAL GUNUNG TRIGLAV ORIGINAL,65000,Baru,26
88,Sandal gunung carvil Spextra Original,70000,Baru,8
89,Sandal Gunung Anak Coloseum Junior Original Outdoor Adventure,134900,Baru,100
90,Sandal Gunung Outdoor Korean Style Harga Murah,89000,Baru,49
91,SENDAL GUNUNG EIGER CALDERA ORIGINAL - SENDAL EIGER,289000,Baru,2
92,Sandal Gunung Pria Sport Casual Japanese Style Size 39-43 Grosir Termurah Sebukalapak,50000,Baru,999997
93,Sandal Gunung Pria Navajo Arei Outdoorgear,129000,Baru,2
94,LUBRENE GABINO-GM SANDAL GUNUNG PRIA,99500,Baru,10
95,Sandal Gunung Pria CT 30 Original Sendal Hiking Travelling Outdoor,145000,Baru,249
96,TERMURAH TERLARIS Sandal jepit Pria Sendal Gunung Hiking Pria ERG bisa cod,55000,Baru,6169
97,SANDAL PRIA HARLEY DAVIDSON KULIT SANDAL KULIT MURAH SANDAL HARLEY DAVIDSON SANDAL PRIA MURAH SANDAL KICKERS SANDAL GUNUNG,105000,Baru,27
98,Sandal Casual Wanita Original Sendal Kasual Cewek Travelling Santai Gunung Outdoor,225000,Baru,100
99,Sandal Kulit Gunung Borsa - BALI - D.Tan,289000,Baru,2
100,Sandal Gunung Talincang ZA Sport,38000,Baru,200
101,Sendal Gunung Keren Pria Trendy,114000,Baru,2
102,Sandal Casual Pria S 26 Original Sendal Gunung Hiking Travelling Outdoor,190000,Baru,99
103,Sandal Premium Quality Slide On Pria Original ORLANDO Sendal Gunung Outdoor Jepit Laki-laki Terbaru CLC 27,200000,Baru,19
104,SANDAL SANTAI PRIA KULIT SANDAL KULIT PRIA MURAH SANDAL MURAH SANDAL GUNUNG SEPATU SANDAL SANDAL EIGER,70000,Baru,35
105,Sandal Gunung Pria Carvil Vero Black Brown ORI,99800,Baru,2
106,PROMO Sandal Gunung Outdoor Pro Original - Sandal Jepit Pria - Sandal Hiking - Gosend Bekasi,129000,Baru,224
107,Sandal Gunung Casual Pria B7 Original Sendal Outdoor Travelling Kasual,215000,Baru,99
108,Sepatu Sandal Anak Perempuan Bayi Balita Usia 6 7 8 9 10 11 Bulan 1 2 3 Tahun Sendal Gunung Cewek Prewalker Karet Phylon Ringan -Balacca 044b-,23900,Baru,99
109,Sandal Gunung Pria Super Big Size 44-45-46-47-48-49 Sendal Pria jumbo,250000,Baru,15
110,Sandal Hipzo CT 04 Pria Sandal Gunung Original,180000,Baru,991
111,SANDAL GUNUNG TRIGLAV ORIGINAL 100,59900,Baru,38
112,Sandal Gunung Sandal Pria Import Adventure Footwear Eva Elastis Sandal Sport Fashion Korea,200000,Baru,296
113,Sandal Gunung Cafu Camaro,115000,Baru,9
114,Sendal Outdoor Adventure COLOSEUM 2 Sandal Gunung Pria ORIGINAL,155000,Baru,2
115,Sandal Jepit Japit Gunung ERGER - bukan Sendal EIGER mantap dan murah poll,27400,Baru,22
116,Sandal Gunung Anak Ando Upin Ipin Biru ORI,47800,Baru,1
117,Sandal Gunung Pria Carvil Rocket Brown ORI,119800,Baru,2
118,Sandal Gunung Pria Terbaru - Sandal Adventure Pria,173000,Baru,2
119,Sandal Gunung Pria Dakkari Rosy 01 ORI,109800,Baru,1
120,PROMO SANDAL JEPIT GUNUNG OUTDOOR TERMURAH SANDAL ANAK SIZE 33/38/43,49900,Baru,998
121,Sandal Pria Casual Sandal Gunung Pria Kasual Cowok MTD02,58000,Baru,99
122,Sandal Wanita Wedges Cewek Selop Cantik Sandal Gunung Kasual Cewek Keren Casual RV02,55000,Baru,184
123,Sandal Gunung Pria - Sandal Weidenmann Bomber Hitam,280000,Baru,114
124,Sandal Pria - Sendal Gunung - Weidenmann Adventure,149000,Baru,135
125,Sandal Gunung Wanita Leon Size 37-40 Grosir Termurah Sebukalapak,39000,Baru,999999
126,Sandal Gunung Anak Pria Wanita Sendal Gunung Outdoor Unisex Laki Sale Promo Murah Grosir,21900,Baru,975
127,Sandal gunung Jumbo sandal big size,78900,Baru,97
128,Sandal Sepeda MTB Sendal Gunung Hiking Karrimor sepatu gunung,180000,Baru,54
129,Sandal Pria Joemen S13 New Wanita Sendal Gunung Outdoor Original Joemen,110000,Baru,499
130,Sendal Gunung Pria CONNEC SANTIAGO Sandal Cowok - CORAL,146000,Baru,6
131,Sandal Gunung Wanita Kasogi ORI,59800,Baru,2
132,Sandal Casual Wanita Original Sendal Kasual Cewek Santai Travelling Gunung Outdoor,225000,Baru,100
133,Sendal Gunung Hitam Pria Keren - Sandal Hiking Pria,109250,Baru,1
134,Sandal Gunung Pria Trendy Original RedRox Best Quality - PR 01,60000,Baru,155
135,Sandal Gunung Anak Laki-laki,113500,Baru,4
136,Sendal Gunung Pria CONNEC SANUR Sandal Cowok - Hitam,161000,Baru,4
137,Sandal Wanita Original Hipzo E-2 Sandal Santai Wanita gunung kasual ootd,250000,Baru,99
138,Sandal Sepatu Tali Wanita 2 warna Sepatu Sandal Cewek Modis Fashion Korea Sandal Gunung Tali Perempuan Murah,62900,Baru,978
139,Sandal sepeda gunung Karrimor,180000,Baru,24
140,Sandal gunung japit pria HN 16,79000,Baru,999
141,Sandal Sendal Gunung Outdoor Pro Women series Gaia Red,135000,Baru,5
142,Sandal Gunung Tali Import Anak Cewek Cowok Fashion Korea Sandal Sport Running Kids Anak 678910 Tahun Modis Trendy Sepatu Sandal Tali Strap2 Anak,100000,Baru,997
143,Sandal Gunung Pria - sandal gunung Weidenmann Climber 10,169000,Baru,196
144,sendal pria dan wanita connec columbia sandal gunung treveling,154000,Baru,9
145,Sandal Gunung Anak Laki Laki Perempuan Nevis NVS 56 Original Ukuran 28-37,95000,Baru,999
146,Sendal Gunung Pria Hiking Traveling Original - Sandal Outdoor,112000,Baru,2
147,Sandal Gunung Unisex Pria Wanita Keren Berkualitas,112000,Baru,3
148,Sepatu Gunung Outdoor Slip On Original Pria Sneakers Sandal Sport Casual Olahraga Running Adventure Cowok Keren AGC110366,300000,Baru,10
149,Sandal Gunung Hiking Anak Laki-laki,203900,Baru,3
150,Sandal Gunung Anak Laki-laki - Sandal Anak Laki - Sandal Gunung - Sandal Berkualitas - Sandal Keren,115500,Baru,2
151,Sepatu Sandal Wanita Import Premium Quality Sandal Gunung Sandal Anti Licin ID134,250000,Baru,100
152,Elmer-Sandal Gunung Ranger,132000,Baru,1
153,Elmer-Sandal Gunung Slecker,129000,Baru,1
154,Elmer-Sandal Jepit Gunung Tracking 2,115000,Baru,13
155,Elmer-Sandal Jepit Gunung Tracking 1,109000,Baru,10
156,Sandal Sepeda MTB Sendal Gunung Hiking Karrimor outdoor,180000,Baru,24
157,sepatu sandal gunung hitam wanita,65000,Baru,96
158,Sandal Pria Gunung Outdoor Original Lozta WLT 05,129000,Baru,17
159,Sandal Gunung Pria- Velo-XPander-50,105000,Baru,35
160,Sendal Gunung Pria Sandal Connec COLOMBIA - Cokelat Tua,156000,Baru,8
161,Sandal Gunung Outdoor Wanita Ontop Raya,135000,Baru,6
162,Sandal Hiking Anak/Sandal Gunung Anak/Sandal Anak (Java 7) - MDJ 006,86000,Baru,46
163,Sandal Gunung Pria Original Sandal Pocket Original Kojo Pandemic 2,225000,Baru,97
164,SANDAL GUNUNG TRIGLAV ARMY PREMIUM SANDAL OUTDOOR,95000,Baru,98
165,SH37 Sandal Gunung Import Pria Keren Empuk,90000,Baru,158
166,Sandal Gunung Wanita - Sendal Gunung Cewek Original,187500,Baru,9
167,Elmer-Sandal Jepit Gunung Photina,119000,Baru,5
168,Sandal gunung Boogie Halmahera original,170000,Baru,4
169,Sandal Pria Hipzo CT-33 Terbaru Sandal Gunung Pria,150000,Baru,100
170,Lvnatica Sandals - Almost Series Men's Casual Sandal | Sandal Gunung Pria,245000,Baru,100
171,TERMURAH TERLARIS Sandal jepit Pria Sendal Gunung Hiking Pria ERG bisa cod,55000,Baru,6169
172,sandal gunung hitam dewasa,27000,Baru,36
173,Sandal Gunung Carvil-Carvil Redford-GM-001,115000,Baru,3
174,Sepatu Sendal Gunung Pria. Sendal Hiking Mendaki Outdoor. Sandal Outdoor Pria. Sendal Mendaki Trecking Adventure Slop,279000,Baru,100
175,Sandal Gunung Sendal Gunung Anak Pria Wanita Unisek Laki Murah,20500,Baru,999
176,Sandal Gunung Wanita Sandal Korea Casual MD13,55000,Baru,200
177,SANDAL HOMYPED MA 2032 - SENDAL GUNUNG ADVENTURE HOMYPED SDL554,289900,Baru,10
178,SENDAL GUNUNG OUTDOOR PRO ARVAK VX SANDAL GUNUNG PRIA WANITA,165000,Baru,10
179,SANDAL PRIA DAN WANITA CASUAL. SANDAL GUNUNG OUTDOOR MURAH PROMO. SENDAL SELOP DISTRO,54500,Baru,794
180,SANDAL GUNUNG TRIGLAV PREMIUM ARMY,95000,Baru,96
181,Lvnatica Sandals - Oregano Black Men's Casyal Sandal | Sandal Gunung Pria,285000,Baru,10
182,Lvnatica Sandals - Almost 2.0 Ocean Series Men's Casual Sandal | Sandal Gunung Pria,399000,Baru,10
183,sepatu sendal anak laki laki perempuan sendal gunung balita SH20133 Sepatu sendal anak Unisex  Sandal Gunung anak,150000,Baru,10
184,Sandal Tali Gunung Wanita Korea Footwear Wanita Terbaru 37 40 SIZE,135000,Baru,188
185,Sendal Safety Gunung Pria - Sandal Outdoor Pria - Sandal Tali Pria - Sandal Gunung Pria Berkualitas - Sandal Cowok - Sandal Adventure - Sandal Hiking,129750,Baru,4
186,Alope - Loco Sandal Pria Sendal Gunung Selop Kasual,137000,Baru,9997
187,sandal anak laki-laki - sendal gunung merah dan brown - sandal gunung anak jv,120000,Baru,35
188,Sandal Gunung Alope Yeager Get Kaos Kaki,174900,Baru,1000
189,SANDAL GUNUNG ANAK GOPRO TERMINATOR TP,77000,Baru,3
190,sepatu sandal gunung OUTDOOR ORIGINAL sendal hiking pria MURAH sendal gunung cowok karrimor snta tnf rei eiger,350000,Baru,55
191,Sendal atau  Sandal Gunung Boogie Kalao,110000,Baru,50
192,Sandal Pria Wanita Original Hipzo Pria CT 03 Sendal Pria Gunung Premium Slop Import Casual,150000,Baru,100
193,Sandal Gunung Hiking Adventure Pria Sendal Terbaru Cowok Trendy JB25,189000,Baru,22
194,Sandal Gunung Outdoor Antarestar Sandal Treveling Hiking Nyaman,88500,Baru,100
195,SANDAL GUNUNG PROATT ANAK REMAJA SDL569,67000,Baru,16
196,Sandal Outdoor Keren Pria - Sandal Gunung Trendy - Sandal Hiking,118500,Baru,3
197,Sandal Gunung Pria Hiking Original - Sendal Outdoor Cowok Golfer,170500,Baru,7
198,Sandal Gunung Pria Keren - Sandal Trekking Ninja,151500,Baru,5
199,Sandal Gunung Keren Warna Abu,129500,Baru,4
200,Sandal Gunung Pria - Sendal Outdoor Trekking,149000,Baru,4
201,Sendal Hiking Pria Berkualitas Keren - Sandal Gunung Pria,137000,Baru,2
202,Sendal Gunung Pria Outdoor - Sandal Traveling Hiking Casual,177000,Baru,2
203,Sandal Gunung Anak Laki-laki Keren Masa Kini - Sandal Jepit Anak Laki Hiking - Sandal Keren Anak Cowok - Sandal Anak Laki-laki - Sandal Tali Casual,106000,Baru,2
204,Sendal Keren Anak Laki-laki Casual Trendy - Sandal Kasual Anak Laki-laki - Sandal Gunung Anak Laki-laki Keren - Sandal Hiking Anak Laki-laki Original,111750,Baru,4
205,Sepatu Gunung Outdoor Slip On Original Pria Sneakers Sandal Sport Casual Olahraga Running Pantai Adventure Murah Cowok AGC110366,300000,Baru,10
206,sandal gunung pria laki laki weidenmann sukhoi,255000,Baru,10
207,sandal anak pria - sendal anak laki-laki - sandal gunung bandung awet berkualitas cs,110000,Baru,36
208,Sandal Gunung dan Travelling Garfield Black White By Osgood Footwear,210000,Baru,31
209,Sandal Gunung / Sandal Tali / Sendal Gunung PortoLite A 002 M,98000,Baru,50
210,Sandal gunung Weidenmann Climber-06,169000,Baru,97
211,Sandal Outdoor Pria Big Size 44-45-46-47-48-49 Sendal Gunung Jumbo,250000,Baru,15
212,Sandal Pria Sandal Gunung Weidenmann Sukhoi Coklat,245000,Baru,7
213,Sandal gunung triglav original premium,65000,Baru,1072
214,Sandal Gunung Pria Terbaru - Sandal Adventure Pria,173000,Baru,2
215,promo sandal anak wanita sendal anak lucu sendal gunung anak sandal let cewek trend 2021 bisa cod,49900,Baru,40
216,Sendal Gunung Spiderman Anak Laki-laki Trendy,105950,Baru,3
217,Sendal Gunung Anak Laki-laki Berkualitas - Sandal Outdoor Anak - Sandal Anak Laki Adventure - Sandal Trekking Anak Laki - Sandal Gunung Keren Anak,110750,Baru,2
218,Sandal Gunung Pria - Sandal Outdoor - Sandal Hiking,137000,Baru,2
219,Sepatu Gunung Outdoor Slip On Original Pria Sneakers Sandal Sport Casual Olahraga Running Pantai Adventure Cowok AGC110366,300000,Baru,10
220,Sendal Gunung Anak Laki-laki Desain Trendy - Sandal Outdoor Original,108750,Baru,2
221,Sandal Gunung Pria Wanita Hiking Haji Umrah Hijau Army LAF Project - 42,199000,Baru,100
222,Sandal Gunung Pria HN 02,59900,Baru,499
223,"SANDAL OUTDOOR TREKKING GUNUNG ADVENTURE PRIA GF3303H
MERAH",105000,Baru,10
224,Sandal Gunung Anak Laki Laki CJR - CJJ 100,85000,Baru,99
225,Sandal Trail Hiking Gunung Outdoor Pro Aragon Red Original Pro Outdoor,170000,Baru,11
226,Sandal Gunung Outdoor Pro SABER Sandal Hiking Trekking Pro Outdoor SABER,145000,Baru,17
227,Sandal Gunung Efrain Sean Sandal Sendal Pria Wanita Import Sandal Gunung Ambigo Outdoor Traveling,200000,Baru,250
228,Sandal Jepit Gunung Pria Nevis NVS 15 Original,99900,Baru,196
229,SH65 Sepatu Sandal Wanita Import Premium Quality Sandal Gunung Sandal Anti Licin,160000,Baru,242
230,Sandal Gunung Wanita Sepatu Sendal Cewek Sendal Gunung Anti Licin SP32,74900,Baru,50
231,Sendal Hiking Keren Anak Laki-laki - Sandal Gunung Anak Laki Keren - Sandal Outdoor Anak - Sandal Anak Laki-laki - Sendal Anak Laki - Sendal Gunung,98250,Baru,1
232,Sandal Gunung Pria - Sandal Outdoor Pria,118500,Baru,2
233,Sepatu Gunung Outdoor Slip On Original Pria Sneakers Sandal Sport Casual Olahraga Running Lari Pantai Adventure Cowok AGC110366,300000,Baru,10
234,Sandal Tali Wanita PVN Kekinian Sendal Gunung Perempuan Terbaru,145000,Baru,166
235,Sandal Gunung Anak Outdoor Adventure Coloseum JR Black Red,100000,Baru,1
236,sandal gunung outdoor sandal hiking grade original,350000,Baru,89
237,Sandal Gunung Outdoor Pria Casual GN VL HITAM,70000,Baru,30
238,Sepatu sandal gunung Weidenmann Tornado-dark brown,275000,Baru,48
239,"Sandal Anak, Sandal Casual Anak, Sandal Gunung Anak (CBR) - MDC 005",89000,Baru,49
240,PROMO Sandal Gunung Pria GRATIS sandal Jepit HN 02,149000,Baru,29
241,Kinkajou Pinch 2.0 Original - Sandal Jepit Gunung Pria - Sandal Eiger,199000,Baru,6
242,ALTO BLACK FORIND x Lvnatica Sendal Gunung Original Kulit Santai Kasual Pria - Sandal Footwear,260000,Baru,4002
243,Sandal Gunung Sabertooth Terra Magnazen - Sandal Outdoor,146000,Baru,17
244,Sandal Gunung Pria Golfer - GF 3303,109000,Baru,100
245,SANDAL GUNUNG ARDILES PRIA DEWASA SDL217,82500,Baru,28
246,Sepatu Sendal Wedges Casual Gunung Wanita Import Premium Qualty ID140,250000,Baru,99
247,Sandal Premium Quality Slide On Pria Original ORLANDO Sendal Gunung Outdoor Jepit Laki-laki Termurah CLC 27,200000,Baru,19
248,Sandal Gunung Pria Silver Murah,200000,Baru,1091
249,Sepatu Sandal Anak Import Velcro Sandal Gunung Anak  MATEO hys Jelly,68500,Baru,100
250,Sepatu Sandal Gunung Wanita Import Premium Qualty Anti Licin Bahan Kanvas ID123,225000,Baru,98
251,Sandal Gunung Baby Kids YUMEIDA,29900,Baru,2
252,Sandal Gunung Karet Cross Baby Kids YUMEIDA,29900,Baru,1
253,Sandal Gunung Karet Cross Anak YUMEIDA KIDS,29900,Baru,1
254,Sandal Gunung Karet Anak ODE,29900,Baru,1
255,TERMURAH TERLARIS Sandal jepit Pria Sendal Gunung Hiking Pria ERG bisa cod,65000,Baru,6218
256,Sendal Dewasa Wakai Pria wanita - Sandal Wakai santai jepit gunung terbaru lebaran terbaru murah,50000,Baru,992
257,LUBRENE LISTEN-GL SANDAL GUNUNG WANITA,68900,Baru,8
258,Sandal Jepit Anak - Sendal Anak - Sendal Gunung - Sendal Selop - Sendal Anak Unisex - Sendal Santai - Sendal Outdoor - Sandal Main Anak,85000,Baru,996
259,Sandal Pria Wanita Gunung Hiking Haji Umrah Hijrah Casual Jack V1 LAF Project,199000,Baru,100
260,Mozambique Men Eiger Original - Sandal Gunung Casual Pria,259000,Baru,2
261,SANDAL JEPIT GUNUNG HIKING PANTAI TRAVELLING ORIGINAL OUTDOOR PRO DUELER MTX,110000,Baru,49
262,SANDAL GUNUNG TRIGLAV ORIGINAL 100 ORI,59000,Baru,98
263,Sandal Gunung Weidenmann Tornado coklat original,255000,Baru,27
264,Sandal Gunung Outdoor Wanita Malona,135000,Baru,3
265,PROMO  Sandal Gunung Anak ORIGINAL,59999,Baru,59
266,Sandal Jepit Anak Laki Laki Dan perempuan . Sendal Jepit Gunung Anak Junior Baby,79800,Baru,1000
267,Sandal Gunung Selop Pria Casual - Selop PL 01 ARMY,99000,Baru,2000
268,sandal gunung pria weidenmann tornado,265000,Baru,100
269,Sandal Gunung Pria Ziel Project SN-005 Sendal Cowok Hiking Selop Japit Original Terbaru Premium,110000,Baru,978
270,sendal anak cowok anak pria - sandal gunung - sandal awet berkualitas cs murah,115000,Baru,20
271,Sandal Pria - Sendal Gunung - Weidenmann Climber,169000,Baru,272
272,Sendal Outdoor - Sandal Outdoor - Sandal Gunung Pria - Sandal Jepit Gunung Outdoor Pro Saber,130000,Baru,15
273,Sandal Gunung Anak Original Nevis Footwear NVS 21 Sendal Anak Laki Laki Perempuan Ukuran 33 34 35 36 37,99900,Baru,98
274,sandal gunung abu - abu polos,26000,Baru,437
275,anak laki-laki sendal gunung anak jv seven terlaris murah,99000,Baru,24
276,CONNEC GENECO Sendal Jepit Pria Sandal Gunung Pantai Santai Cowok,116000,Baru,3
277,PREMIUM - Sandal Gunung Outdoor Pro Original - Tipe Infinity - Bekasi,164900,Baru,110
278,Sandal Gunung Wanita Modis Model Korea Sandal Wedges Tali Cewek Pro Fashion Sendal Gunung Wedges Perempuan Murah Promo Terbaru Sandal Sepatu Wedges,65000,Baru,255
279,sandal anak laki laki model baru murah - sandal gunung anak cowok keren bcl - sendal main santai anak,110000,Baru,12
280,Sandal Casual Wanita Original Sendal Kasual Cewek Travelling Santai Gunung Outdoor,225000,Baru,100
281,Sendal Gunung Consina Kanawa Super Light Sandal,175000,Baru,2
282,SANDAL COWO MONDAY NERO BLACK TOTOSURYO x MONDAY FOOTWEAR FULL ORIGINAL SANDAL COWOK SANDAL GUNUNG SENDAL GUNUNG,200000,Baru,56
283,New Yeager Alope Sandal pria sendal gunung cowok cewek terlaris kasual trendy,177000,Baru,1000
284,SANDAL PRIA HARLEY DAVIDSON KULIT SANDAL KULIT MURAH SANDAL HARLEY DAVIDSON SANDAL PRIA MURAH SANDAL KICKERS SANDAL GUNUNG,105000,Baru,27
285,sendal outdoor- sendal gunung-sendal pria -sendal original,130000,Baru,92
286,Spotec Original Legendary Healthy Sandal Hiking Gunung Tracking - Sandy Full Black,579000,Baru,19
287,Sandal Gunung CONVERSE . Sendal Outdoor Pria . Sendal Pria Sporty . Sendal Gunung Jepit,95000,Baru,1000
288,Sandal Gunung Anak Perempuan - Sendal Velox - Vallen Jr,79900,Baru,3
289,NO 41 CARVIL ERAGON GM BLACK sandal pria sandal gunung outdoor,99000,Baru,3
290,Sandal Gunung Pria Original Nevis Nvs 14 Sandal Pria Outdoor Hiking,119000,Baru,97
291,Sendal Gunung Pria Sandal Connec COLOMBIA - Hitam Merah,156000,Baru,43
292,Sandal Gunung Sandal Selempang Cozmeed Chinelos,135000,Baru,24
293,Sendal gunung Weidenmann Climber 02 Olive,170000,Baru,12
294,Sandal Jepit Gunung Akasaka Arwen TBS Sandal Original Sendal Outdoor,150000,Baru,2
295,Sandal Gunung Hiking Casual Pria Wanita Haji Umrah Jack V3 LAF Project - 39,399000,Baru,100
296,Sandal gunung Weidenmann Tornado. original,255000,Baru,12
297,chocobaby FEILUFU 2289 1 Sandal gunung Sepatu Sandal Anak Laki Laki Bahan PU Model Lucu 4-9 Tahun Import,312000,Baru,5
298,Sandal Casual Pria S 26 Original Sendal Gunung Hiking Travelling Outdoor,190000,Baru,99
299,SANDAL GUNUNG TRIGLAV HIKING PRIA WANITA ORIGINAL,59000,Baru,197
300,Sandal Gunung Pria HN 03,59900,Baru,50
301,Rei Sandal Gunung Astec,109000,Baru,1
302,sandal gunung wanita original B3 - sandal outdoor cewek - sandal trekking wanita,133000,Baru,11
303,Sandal Gunung Sepatu Sandal Pria - Connec Columbia,165000,Baru,3
304,Sandal Gunung Motif Cafu Indian Sandal Outdoor,109900,Baru,2
305,Sandal Connec Flash Sendal Outdoor Sandal Gunung,100000,Baru,10
306,SANDAL GUNUNG ANAK KIDS HIKING TRAVELING ORIGINAL OUTDOOR PRO VOLT,135000,Baru,100
